,,,,,PayEm-FX,,,,,,,,,,,,,,,,,,,,,,,,,,,,,,,,,,,,,,,,,,,,,,,,,,,,,,,
Date,Time,Status,Sync Status,Transaction type,Amount,Currency,Original Amount,Original Currency,Subsidiary,Subsidiary ERP ID,Department,Department ERP ID,Expense Account Name,Expense Account Number,Vendor ERP ID,Budget item,Budget item Code,Statement Month,Transaction Notes (Memo),Invoice Number,Invoice Posting Date,Invoice Due Date,Invoice Start Date,Invoice End Date,Invoice Tax Amount,Invoice Tax Currency,Invoice Includes VAT,Merchant,Merchant ID,Merchant address,Merchant Category,Merchant Category Code,Extended Category (IRS Category),Recurring Transaction,Card Last 4,Card type,Cardholder,Card Label,Shared To,Receipt,PayEm Transaction ID,Account ERP ID,Expense Category,Source,Date,Month,Transaction amount,Currency,Currency rate,Amount USD,Expenses Category,VAT USD,Net Amount USD,Report,Name / Comments,Short Name,Department,Chart of Accounts - Name,Chart of Accounts - Number,Date
2026-01-01,01:03,CLEARED,NO_SYNC,Bill + Bill payment,"$1,702.78",USD,1702.78,USD,Brandlight AI LTD,517057576,,,,,,,,,,,2026-01-01,2026-01-01,,,,,0,BRIGHTDATA,9.12E+11,"412-5966371, USA, 10018",Computer Software Stores,5734,Computer Software Stores,1,5652,Employee - Virtual,SaaS and Subscriptions,SaaS and Subscriptions,"Didi Dvash, Gal Rubin",,6238902,,,Brandlight AI LTD-PayEm-SaaS and Subscriptions-5652,1 Jan 26,01-26,"($1,703)",USD,1,"($1,703)",Technology,-,"($1,703)",Yes,BRIGHTDATA,,G&A,,,1/1/2026
2026-01-01,07:18,CLEARED,NO_SYNC,Bill + Bill payment,$53.24,USD,164,ILS,Brandlight AI LTD,517057576,,,,,,,,,,,2026-01-01,2026-01-01,,,,,0,MAX 10,6624753,"TEL AVIV-JAF, ISR, 00000",Household Appliance Stores,5722,Household Appliance Stores,0,3635,Employee - Virtual,Gal Rubin,Gal Rubin,Gal Rubin,,6240139,,,Brandlight AI LTD-PayEm-Gal Rubin-3635,1 Jan 26,01-26,($53),USD,1,($53),Refreshments & Welfare,-,($53),Yes,MAX 10,#REF!,S&M,,,1/1/2026
2026-01-01,07:41,CLEARED,NO_SYNC,Bill + Bill payment,$5.16,USD,5.16,USD,Brandlight AI LTD,517057576,,,,,,,,,,,2026-01-01,2026-01-01,,,,,0,OpenAI,SXONGQUGQWWJUTM,#ERROR!,Computer Software Stores,5734,Computer Software Stores,1,5652,Employee - Virtual,SaaS and Subscriptions,SaaS and Subscriptions,"Didi Dvash, Gal Rubin",,6240253,,,Brandlight AI LTD-PayEm-SaaS and Subscriptions-5652,1 Jan 26,01-26,($5),USD,1,($5),Technology,-,($5),Yes,OpenAI,#REF!,S&M,,,1/1/2026
2026-01-01,07:47,CLEARED,NO_SYNC,Bill + Bill payment,"$5,000.00",USD,5000,USD,Brandlight AI LTD,517057576,,,,,,,,,,,2026-01-01,2026-01-01,,,,,0,OpenAI,SXONGQUGQWWJUTM,#ERROR!,Computer Software Stores,5734,Computer Software Stores,0,5883,Employee - Virtual,Aviv Zaken,Aviv Zaken,,,6240285,,,Brandlight AI LTD-PayEm-Aviv Zaken-5883,1 Jan 26,01-26,"($5,000)",USD,1,"($5,000)",Technology,-,"($5,000)",Yes,OpenAI,#REF!,R&D,,,1/1/2026
2026-01-01,07:48,CLEARED,NO_SYNC,Bill + Bill payment,"$5,000.00",USD,5000,USD,Brandlight AI LTD,517057576,,,,,,,,,,,2026-01-01,2026-01-01,,,,,0,OpenAI,SXONGQUGQWWJUTM,#ERROR!,Computer Software Stores,5734,Computer Software Stores,0,5883,Employee - Virtual,Aviv Zaken,Aviv Zaken,,,6240289,,,Brandlight AI LTD-PayEm-Aviv Zaken-5883,1 Jan 26,01-26,"($5,000)",USD,1,"($5,000)",Technology,-,"($5,000)",Yes,OpenAI,#REF!,S&M,,,1/1/2026
2026-01-01,10:27,CLEARED,NO_SYNC,Bill + Bill payment,"$1,877.03",USD,5782,ILS,Brandlight AI LTD,517057576,,,,,,,,,,,2026-01-01,2026-01-01,,,,,0,HENION ASOLELIM,6.25E+06,"TEL AVIV-JAF, ISR, 00000",Automobile Parking Lots and Garages,7523,"Parking Lots, Garages",0,3635,Employee - Virtual,Gal Rubin,Gal Rubin,Gal Rubin,https://app.payemcard.com/api/transactions/6241071/receipt.pdf,6241071,,,Brandlight AI LTD-PayEm-Gal Rubin-3635,1 Jan 26,01-26,"($1,877)",USD,1,"($1,877)",#N/A,-,"($1,877)",#N/A,HENION ASOLELIM,#REF!,S&M,#N/A,#N/A,1/1/2026
2026-01-01,12:48,CLEARED,NO_SYNC,Bill + Bill payment,$118.80,USD,118.8,USD,Brandlight AI LTD,517057576,,,,,,,,,,,2026-01-01,2026-01-01,,,,,0,Docusign,4.79E+14,"Wilmington, USA, 19810",Digital Goods – Applications (Excludes Games),5817,,1,5652,Employee - Virtual,SaaS and Subscriptions,SaaS and Subscriptions,"Didi Dvash, Gal Rubin",,6242121,,,Brandlight AI LTD-PayEm-SaaS and Subscriptions-5652,1 Jan 26,01-26,($119),USD,1,($119),Tools,-,($119),Yes,Docusign,#REF!,S&M,,,1/1/2026
2026-01-01,14:41,CLEARED,NO_SYNC,Bill + Bill payment,$1.00,USD,1,USD,Brandlight Inc.,,,,,,,,,,,,2026-01-01,2026-01-01,,,,,0,RYAN DOYLE,PISK4CDOM4TO8C3,"RPDOYLE.COM, USA, 14532",Professional Services ( Not Elsewhere Defined),8999,Professional Services,0,9778,Employee - Virtual,Omer Maimon,Omer - US,,,6243164,,,Brandlight Inc.-PayEm-Omer Maimon-9778,1 Jan 26,01-26,($1),USD,1,($1),#N/A,-,($1),#N/A,RYAN DOYLE,#REF!,S&M,#N/A,#N/A,1/1/2026
2026-01-01,15:54,CLEARED,NO_SYNC,Bill + Bill payment,$268.15,USD,826,ILS,Brandlight AI LTD,517057576,,,,,,,,,,,2026-01-01,2026-01-01,,,,,0,HENION ASOLELIM,6249577,"TEL AVIV-JAF, ISR, 00000",Automobile Parking Lots and Garages,7523,"Parking Lots, Garages",0,3635,Employee - Virtual,Gal Rubin,Gal Rubin,Gal Rubin,https://app.payemcard.com/api/transactions/6244204/receipt.pdf,6244204,,,Brandlight AI LTD-PayEm-Gal Rubin-3635,1 Jan 26,01-26,($268),USD,1,($268),#N/A,-,($268),#N/A,HENION ASOLELIM,#REF!,R&D,#N/A,#N/A,1/1/2026
2026-01-01,18:24,CLEARED,NO_SYNC,Bill + Bill payment,$457.33,USD,457.33,USD,Brandlight AI LTD,517057576,,,,,,,,,,,2026-01-01,2026-01-01,,,,,0,ANTHROPIC,Q0RRUWQV26H30SO,#ERROR!,Computer Software Stores,5734,Computer Software Stores,0,5652,Employee - Virtual,SaaS and Subscriptions,SaaS and Subscriptions,"Didi Dvash, Gal Rubin",,6245442,,,Brandlight AI LTD-PayEm-SaaS and Subscriptions-5652,1 Jan 26,01-26,($457),USD,1,($457),Technology,-,($457),Yes,ANTHROPIC,#REF!,G&A,,,1/1/2026
2026-01-01,21:48,CLEARED,NO_SYNC,Bill + Bill payment,$360.44,USD,360.44,USD,Brandlight AI LTD,517057576,,,,,,,,,,,2026-01-01,2026-01-01,,,,,0,CURSOR USAGE MID  DEC,MZJ96QO0A3SN4BD,"CURSOR.COM, USA, 10025",Computer Software Stores,5734,Computer Software Stores,1,5652,Employee - Virtual,SaaS and Subscriptions,SaaS and Subscriptions,"Didi Dvash, Gal Rubin",https://app.payemcard.com/api/transactions/6246474/receipt.pdf,6246474,,,Brandlight AI LTD-PayEm-SaaS and Subscriptions-5652,1 Jan 26,01-26,($360),USD,1,($360),Technology,-,($360),Yes,CURSOR USAGE MID  DEC,#REF!,S&M,,,1/1/2026
2026-01-02,09:33,CLEARED,NO_SYNC,Bill + Bill payment,$58.14,USD,48,EUR,Brandlight Inc.,,,,,,,,,,,,2026-01-02,2026-01-02,,,,,0,"RIVERSIDEFM, INC.",G8C8GVDLUOOIITY,"PALO ALTO, NLD, 94306","Digital Goods Media – Books, Movies, Music",5815,,1,2875,Employee - Virtual,Rosario Cutuli,Ros - US,,,6249194,,,Brandlight Inc.-PayEm-Rosario Cutuli-2875,2 Jan 26,01-26,($58),USD,1,($58),Miscellaneous,-,($58),Yes,"RIVERSIDEFM, INC.",#REF!,S&M,,,2/1/2026
2026-01-02,10:03,CLEARED,MANUAL,Bill + Bill payment,$16.88,USD,52,ILS,Brandlight AI LTD,517057576,,,,,,,,,,,2026-01-02,2026-01-02,,,,,0,I LOVE CUPCAKES,7.06E+06,"TEL AVIV, ISR, 63117",Bakeries,5462,Bakeries,0,5483,Employee - Virtual,Hila Haliva,Hila Haliva,,https://app.payemcard.com/api/transactions/6249351/receipt.pdf,6249351,,,Brandlight AI LTD-PayEm-Hila Haliva-5483,2 Jan 26,01-26,($17),USD,1,($17),Refreshments & Welfare,-,($17),Yes,I LOVE CUPCAKES,#REF!,S&M,,,2/1/2026
2026-01-02,11:06,CLEARED,NO_SYNC,Bill + Bill payment,$54.15,USD,166.8,ILS,Brandlight AI LTD,517057576,,,,,,,,,,,2026-01-02,2026-01-02,,,,,0,TOP STOCK,4787413,"TEL AVIV YAF, ISR, 00000",Household Appliance Stores,5722,Household Appliance Stores,0,5483,Employee - Virtual,Hila Haliva,Hila Haliva,,https://app.payemcard.com/api/transactions/6249723/receipt.jpg,6249723,,,Brandlight AI LTD-PayEm-Hila Haliva-5483,2 Jan 26,01-26,($54),USD,1,($54),#N/A,-,($54),#N/A,TOP STOCK,#REF!,R&D,#N/A,#N/A,2/1/2026
2026-01-02,17:24,CLEARED,NO_SYNC,Bill + Bill payment,"$1,000.00",USD,1000,USD,Brandlight AI LTD,517057576,,,,,,,,,,,2026-01-02,2026-01-02,,,,,0,BRIGHTDATA,9.12E+11,"412-5966371, USA, 10018",Computer Software Stores,5734,Computer Software Stores,1,5652,Employee - Virtual,SaaS and Subscriptions,SaaS and Subscriptions,"Didi Dvash, Gal Rubin",,6251872,,,Brandlight AI LTD-PayEm-SaaS and Subscriptions-5652,2 Jan 26,01-26,"($1,000)",USD,1,"($1,000)",Technology,-,"($1,000)",Yes,BRIGHTDATA,#REF!,R&D,,,2/1/2026
2026-01-03,08:42,CLEARED,NO_SYNC,Bill + Bill payment,$49.00,USD,49,USD,Brandlight AI LTD,517057576,,,,,,,,,,,2026-01-03,2026-01-03,,,,,0,Webflow,VHWLO7VF91VFRZF,"WEBFLOW.COM, USA, 94103","Computer Programming, Integrated Systems Design and Data Processing Services",7372,Computer Programming,1,5652,Employee - Virtual,SaaS and Subscriptions,SaaS and Subscriptions,"Didi Dvash, Gal Rubin",,6255927,,,Brandlight AI LTD-PayEm-SaaS and Subscriptions-5652,3 Jan 26,01-26,($49),USD,1,($49),Tools,-,($49),Yes,Webflow,#REF!,S&M,,,3/1/2026
2026-01-03,11:17,CLEARED,NO_SYNC,Bill + Bill payment,$5.38,USD,5.38,USD,Brandlight AI LTD,517057576,,,,,,,,,,,2026-01-03,2026-01-03,,,,,0,OpenAI,SXONGQUGQWWJUTM,#ERROR!,Computer Software Stores,5734,Computer Software Stores,1,5652,Employee - Virtual,SaaS and Subscriptions,SaaS and Subscriptions,"Didi Dvash, Gal Rubin",,6256593,,,Brandlight AI LTD-PayEm-SaaS and Subscriptions-5652,3 Jan 26,01-26,($5),USD,1,($5),Technology,-,($5),Yes,OpenAI,#REF!,G&A,,,3/1/2026
2026-01-03,14:15,CLEARED,NO_SYNC,Bill + Bill payment,$500.00,USD,500,USD,Brandlight AI LTD,517057576,,,,,,,,,,,2026-01-03,2026-01-03,,,,,0,Ashby,2CVAWUEQQAX5GVM,#ERROR!,Computer Software Stores,5734,Computer Software Stores,1,5652,Employee - Virtual,SaaS and Subscriptions,SaaS and Subscriptions,"Didi Dvash, Gal Rubin",https://app.payemcard.com/api/transactions/6257451/receipt.pdf,6257451,,,Brandlight AI LTD-PayEm-SaaS and Subscriptions-5652,3 Jan 26,01-26,($500),USD,1,($500),Tools,-,($500),Yes,Ashby,#REF!,G&A,,,3/1/2026
2026-01-04,09:21,CLEARED,NO_SYNC,Bill + Bill payment,$130.04,USD,400,ILS,Brandlight AI LTD,517057576,,,,,,,,,,,2026-01-04,2026-01-04,,,,,0,FALAFEL HATOKA,2878392,"RISHON LEZION, ISR, 75824",Fast Food Restaurants,5814,Fast Food Restaurants,0,3635,Employee - Virtual,Gal Rubin,Gal Rubin,Gal Rubin,https://app.payemcard.com/api/transactions/6261790/receipt.jpg,6261790,,,Brandlight AI LTD-PayEm-Gal Rubin-3635,4 Jan 26,01-26,($130),USD,1,($130),#N/A,-,($130),#N/A,FALAFEL HATOKA,#REF!,G&A,#N/A,#N/A,4/1/2026
2026-01-04,09:38,CLEARED,NO_SYNC,Bill + Bill payment,$5.37,USD,5.37,USD,Brandlight AI LTD,517057576,,,,,,,,,,,2026-01-04,2026-01-04,,,,,0,OpenAI,SXONGQUGQWWJUTM,#ERROR!,Computer Software Stores,5734,Computer Software Stores,1,5652,Employee - Virtual,SaaS and Subscriptions,SaaS and Subscriptions,"Didi Dvash, Gal Rubin",,6261888,,,Brandlight AI LTD-PayEm-SaaS and Subscriptions-5652,4 Jan 26,01-26,($5),USD,1,($5),Technology,-,($5),Yes,OpenAI,#REF!,S&M,,,4/1/2026
2026-01-04,10:12,CLEARED,NO_SYNC,Bill + Bill payment,$18.36,USD,56.5,ILS,Brandlight AI LTD,517057576,,,,,,,,,,,2026-01-04,2026-01-04,,,,,0,Ampm,1602221,"TEL AVIV, ISR, 00000","Grocery Stores, Supermarkets",5411,"Grocery Stores, Supermarkets",0,5483,Employee - Virtual,Hila Haliva,Hila Haliva,,https://app.payemcard.com/api/transactions/6262073/receipt.jpg,6262073,,,Brandlight AI LTD-PayEm-Hila Haliva-5483,4 Jan 26,01-26,($18),USD,1,($18),#N/A,-,($18),#N/A,Ampm,#REF!,S&M,#N/A,#N/A,4/1/2026
2026-01-04,10:30,CLEARED,NO_SYNC,Bill + Bill payment,$540.00,USD,540,USD,Brandlight AI LTD,517057576,,,,,,,,,,,2026-01-04,2026-01-04,,,,,0,ANTHROPIC  CLAUDE TEAM,Q0RRUWQV26H30SO,#ERROR!,Computer Software Stores,5734,Computer Software Stores,1,5652,Employee - Virtual,SaaS and Subscriptions,SaaS and Subscriptions,"Didi Dvash, Gal Rubin",,6262155,,,Brandlight AI LTD-PayEm-SaaS and Subscriptions-5652,4 Jan 26,01-26,($540),USD,1,($540),Technology,-,($540),Yes,ANTHROPIC  CLAUDE TEAM,#REF!,G&A,,,4/1/2026
2026-01-04,13:17,REVERSED,NO_SYNC,Bill + Bill payment,$15.78,USD,50,ILS,Brandlight AI LTD,517057576,,,,,,,,,,,2026-01-04,2026-01-04,,,,,0,GT GET TAXI SYSTEMS LTD,6.04E+06,"TEL AVIV-JAF, ISR, 00000","Transportation Services, Not elsewhere classified)",4789,Transportation Services (Not Elsewhere Classified),0,5483,Employee - Virtual,Hila Haliva,Hila Haliva,,,6263082,,,Brandlight AI LTD-PayEm-Hila Haliva-5483,4 Jan 26,01-26,($16),USD,1,($16),Transportation & Logistics,-,($16),Yes,GT GET TAXI SYSTEMS LTD,#REF!,S&M,,,4/1/2026
2026-01-04,13:36,CLEARED,NO_SYNC,Bill + Bill payment,$5.07,USD,5.07,USD,Brandlight AI LTD,517057576,,,,,,,,,,,2026-01-04,2026-01-04,,,,,0,OpenAI,SXONGQUGQWWJUTM,#ERROR!,Computer Software Stores,5734,Computer Software Stores,1,5652,Employee - Virtual,SaaS and Subscriptions,SaaS and Subscriptions,"Didi Dvash, Gal Rubin",,6263192,,,Brandlight AI LTD-PayEm-SaaS and Subscriptions-5652,4 Jan 26,01-26,($5),USD,1,($5),Technology,-,($5),Yes,OpenAI,#REF!,S&M,,,4/1/2026
2026-01-04,14:24,CLEARED,NO_SYNC,Bill + Bill payment,$7.67,USD,23.6,ILS,Brandlight AI LTD,517057576,,,,,,,,,,,2026-01-04,2026-01-04,,,,,0,I B I CAPITAL LTD,9572124,"TEL AVIV - Y, ISR, 00000","Accounting, Auditing, and Bookkeeping Services",8931,Accounting/Bookkeeping Services,0,3635,Employee - Virtual,Gal Rubin,Gal Rubin,Gal Rubin,https://app.payemcard.com/api/transactions/6263441/receipt.pdf,6263441,,,Brandlight AI LTD-PayEm-Gal Rubin-3635,4 Jan 26,01-26,($8),USD,1,($8),#N/A,-,($8),#N/A,I B I CAPITAL LTD,#REF!,S&M,#N/A,#N/A,4/1/2026
2026-01-04,14:28,CLEARED,NO_SYNC,Bill + Bill payment,$25.98,USD,79.9,ILS,Brandlight AI LTD,517057576,,,,,,,,,,,2026-01-04,2026-01-04,,,,,0,GT GET TAXI SYSTEMS LTD,6.04E+06,"TEL AVIV-JAF, ISR, 00000","Transportation Services, Not elsewhere classified)",4789,Transportation Services (Not Elsewhere Classified),0,5483,Employee - Virtual,Hila Haliva,Hila Haliva,,,6263460,,,Brandlight AI LTD-PayEm-Hila Haliva-5483,4 Jan 26,01-26,($26),USD,1,($26),Transportation & Logistics,-,($26),Yes,GT GET TAXI SYSTEMS LTD,#REF!,G&A,,,4/1/2026
2026-01-04,16:53,CLEARED,NO_SYNC,Bill + Bill payment,$20.00,USD,20,USD,Brandlight AI LTD,517057576,,,,,,,,,,,2026-01-04,2026-01-04,,,,,0,WWW.PERPLEXITY.AI,GWLETHIMMO07FWD,#ERROR!,"Digital Goods Media – Books, Movies, Music",5815,,0,3635,Employee - Virtual,Gal Rubin,Gal Rubin,Gal Rubin,,6264200,,,Brandlight AI LTD-PayEm-Gal Rubin-3635,4 Jan 26,01-26,($20),USD,1,($20),Tools,-,($20),Yes,WWW.PERPLEXITY.AI,#REF!,S&M,,,4/1/2026
2026-01-04,18:36,CLEARED,NO_SYNC,Bill + Bill payment,$453.84,USD,453.84,USD,Brandlight AI LTD,517057576,,,,,,,,,,,2026-01-04,2026-01-04,,,,,0,ANTHROPIC,Q0RRUWQV26H30SO,#ERROR!,Computer Software Stores,5734,Computer Software Stores,0,5652,Employee - Virtual,SaaS and Subscriptions,SaaS and Subscriptions,"Didi Dvash, Gal Rubin",,6264643,,,Brandlight AI LTD-PayEm-SaaS and Subscriptions-5652,4 Jan 26,01-26,($454),USD,1,($454),Technology,-,($454),Yes,ANTHROPIC,#REF!,S&M,,,4/1/2026
2026-01-04,19:19,CLEARED,NO_SYNC,Bill + Bill payment,$8.18,USD,8.18,USD,Brandlight AI LTD,517057576,,,,,,,,,,,2026-01-04,2026-01-04,,,,,0,Cursor,MZJ96QO0A3SN4BD,#ERROR!,Computer Software Stores,5734,Computer Software Stores,1,5652,Employee - Virtual,SaaS and Subscriptions,SaaS and Subscriptions,"Didi Dvash, Gal Rubin",https://app.payemcard.com/api/transactions/6264832/receipt.pdf,6264832,,,Brandlight AI LTD-PayEm-SaaS and Subscriptions-5652,4 Jan 26,01-26,($8),USD,1,($8),Technology,-,($8),Yes,Cursor,#REF!,G&A,,,4/1/2026
2026-01-05,08:25,CLEARED,NO_SYNC,Bill + Bill payment,$130.04,USD,400,ILS,Brandlight AI LTD,517057576,,,,,,,,,,,2026-01-05,2026-01-05,,,,,0,PITRONOT HDPASA MITKADMIM,2390776,"REHOVOT, ISR, 00000","Quick Copy, Reproduction and Blueprinting Services",7338,"Quick Copy, Repro, and Blueprint",0,3635,Employee - Virtual,Gal Rubin,Gal Rubin,Gal Rubin,https://app.payemcard.com/api/transactions/6267543/receipt.jpg,6267543,,,Brandlight AI LTD-PayEm-Gal Rubin-3635,5 Jan 26,01-26,($130),USD,1,($130),#N/A,-,($130),#N/A,PITRONOT HDPASA MITKADMIM,#REF!,R&D,#N/A,#N/A,5/1/2026
2026-01-05,09:00,CLEARED,NO_SYNC,Bill + Bill payment,$54.14,USD,169,ILS,Brandlight AI LTD,517057576,,,,,,,,,,,2026-01-05,2026-01-05,,,,,0,BASE44,GOKP3GIM5TMZ6QH,#ERROR!,Computer Software Stores,5734,Computer Software Stores,0,5652,Employee - Virtual,SaaS and Subscriptions,SaaS and Subscriptions,"Didi Dvash, Gal Rubin",,6267687,,,Brandlight AI LTD-PayEm-SaaS and Subscriptions-5652,5 Jan 26,01-26,($54),USD,1,($54),Technology,-,($54),Yes,BASE44,#REF!,G&A,,,5/1/2026
2026-01-05,09:08,REVERSED,NO_SYNC,Bill + Bill payment,$15.78,USD,50,ILS,Brandlight AI LTD,517057576,,,,,,,,,,,2026-01-05,2026-01-05,,,,,0,GT GET TAXI SYSTEMS LTD,6035000,"TEL AVIV-JAF, ISR, 00000","Transportation Services, Not elsewhere classified)",4789,Transportation Services (Not Elsewhere Classified),0,5483,Employee - Virtual,Hila Haliva,Hila Haliva,,,6267738,,,Brandlight AI LTD-PayEm-Hila Haliva-5483,5 Jan 26,01-26,($16),USD,1,($16),Transportation & Logistics,-,($16),Yes,GT GET TAXI SYSTEMS LTD,#REF!,G&A,,,5/1/2026
2026-01-05,09:26,CLEARED,NO_SYNC,Bill + Bill payment,$279.46,USD,279.46,USD,Brandlight AI LTD,517057576,,,,,,,,,,,2026-01-05,2026-01-05,,,,,0,Docusign,4.79E+14,"Wilmington, USA, 19810",Digital Goods – Applications (Excludes Games),5817,,1,5652,Employee - Virtual,SaaS and Subscriptions,SaaS and Subscriptions,"Didi Dvash, Gal Rubin",,6267843,,,Brandlight AI LTD-PayEm-SaaS and Subscriptions-5652,5 Jan 26,01-26,($279),USD,1,($279),Tools,-,($279),Yes,Docusign,#REF!,R&D,,,5/1/2026
2026-01-05,09:30,REVERSED,NO_SYNC,Bill + Bill payment,$15.78,USD,50,ILS,Brandlight AI LTD,517057576,,,,,,,,,,,2026-01-05,2026-01-05,,,,,0,GT GET TAXI SYSTEMS LTD,6.04E+06,"TEL AVIV-JAF, ISR, 00000","Transportation Services, Not elsewhere classified)",4789,Transportation Services (Not Elsewhere Classified),0,5483,Employee - Virtual,Hila Haliva,Hila Haliva,,https://app.payemcard.com/api/transactions/6267878/receipt.pdf,6267878,,,Brandlight AI LTD-PayEm-Hila Haliva-5483,5 Jan 26,01-26,($16),USD,1,($16),Transportation & Logistics,-,($16),Yes,GT GET TAXI SYSTEMS LTD,#REF!,R&D,,,5/1/2026
2026-01-05,09:43,CLEARED,NO_SYNC,Bill + Bill payment,$21.77,USD,66.99,ILS,Brandlight AI LTD,517057576,,,,,,,,,,,2026-01-05,2026-01-05,,,,,0,GT GET TAXI SYSTEMS LTD,6.04E+06,"TEL AVIV-JAF, ISR, 00000","Transportation Services, Not elsewhere classified)",4789,Transportation Services (Not Elsewhere Classified),0,5483,Employee - Virtual,Hila Haliva,Hila Haliva,,https://app.payemcard.com/api/transactions/6267954/receipt.pdf,6267954,,,Brandlight AI LTD-PayEm-Hila Haliva-5483,5 Jan 26,01-26,($22),USD,1,($22),Transportation & Logistics,-,($22),Yes,GT GET TAXI SYSTEMS LTD,#REF!,S&M,,,5/1/2026
2026-01-05,10:07,CLEARED,NO_SYNC,Bill + Bill payment,"$1,000.00",USD,1000,USD,Brandlight AI LTD,517057576,,,,,,,,,,,2026-01-05,2026-01-05,,,,,0,BRIGHTDATA,9.12E+11,"412-5966371, USA, 10018",Computer Software Stores,5734,Computer Software Stores,1,5652,Employee - Virtual,SaaS and Subscriptions,SaaS and Subscriptions,"Didi Dvash, Gal Rubin",,6268075,,,Brandlight AI LTD-PayEm-SaaS and Subscriptions-5652,5 Jan 26,01-26,"($1,000)",USD,1,"($1,000)",Technology,-,"($1,000)",Yes,BRIGHTDATA,#REF!,S&M,,,5/1/2026
2026-01-05,17:19,CLEARED,NO_SYNC,Bill + Bill payment,$99.00,USD,99,USD,Brandlight AI LTD,517057576,,,,,,,,,,,2026-01-05,2026-01-05,,,,,0,MEETALFRED.COM,XEFXYH4Z5QC4MPY,"WWW.MEETALFRE, USA, 19901",Computer Software Stores,5734,Computer Software Stores,1,5652,Employee - Virtual,SaaS and Subscriptions,SaaS and Subscriptions,"Didi Dvash, Gal Rubin",,6270604,,,Brandlight AI LTD-PayEm-SaaS and Subscriptions-5652,5 Jan 26,01-26,($99),USD,1,($99),Tools,-,($99),Yes,MEETALFRED.COM,#REF!,S&M,,,5/1/2026
2026-01-05,20:53,CLEARED,NO_SYNC,Bill + Bill payment,$19.95,USD,19.95,USD,Brandlight AI LTD,517057576,,,,,,,,,,,2026-01-05,2026-01-05,,,,,0,Twilio,PGHTNMORBEERSHB,#ERROR!,Computer Software Stores,5734,Computer Software Stores,1,5652,Employee - Virtual,SaaS and Subscriptions,SaaS and Subscriptions,"Didi Dvash, Gal Rubin",,6271837,,,Brandlight AI LTD-PayEm-SaaS and Subscriptions-5652,5 Jan 26,01-26,($20),USD,1,($20),Tools,-,($20),Yes,Twilio,#REF!,S&M,,,5/1/2026
2026-01-05,21:05,CLEARED,NO_SYNC,Bill + Bill payment,$451.22,USD,451.22,USD,Brandlight AI LTD,517057576,,,,,,,,,,,2026-01-05,2026-01-05,,,,,0,ANTHROPIC,Q0RRUWQV26H30SO,#ERROR!,Computer Software Stores,5734,Computer Software Stores,0,5652,Employee - Virtual,SaaS and Subscriptions,SaaS and Subscriptions,"Didi Dvash, Gal Rubin",,6271888,,,Brandlight AI LTD-PayEm-SaaS and Subscriptions-5652,5 Jan 26,01-26,($451),USD,1,($451),Technology,-,($451),Yes,ANTHROPIC,#REF!,S&M,,,5/1/2026
2026-01-05,21:23,CLEARED,NO_SYNC,Bill + Bill payment,$5.10,USD,5.1,USD,Brandlight AI LTD,517057576,,,,,,,,,,,2026-01-05,2026-01-05,,,,,0,OpenAI,SXONGQUGQWWJUTM,#ERROR!,Computer Software Stores,5734,Computer Software Stores,1,5652,Employee - Virtual,SaaS and Subscriptions,SaaS and Subscriptions,"Didi Dvash, Gal Rubin",,6271961,,,Brandlight AI LTD-PayEm-SaaS and Subscriptions-5652,5 Jan 26,01-26,($5),USD,1,($5),Technology,-,($5),Yes,OpenAI,#REF!,G&A,,,5/1/2026
2026-01-05,23:40,CLEARED,NO_SYNC,Bill + Bill payment,"$4,256.25",USD,4256.25,USD,Brandlight AI LTD,517057576,,,,,,,,,,,2026-01-05,2026-01-05,,,,,0,Serpapi,XTAYTV4A13ATCCR,"SERPAPI.COM, USA, 78751",Computer Software Stores,5734,Computer Software Stores,1,5652,Employee - Virtual,SaaS and Subscriptions,SaaS and Subscriptions,"Didi Dvash, Gal Rubin",,6272489,,,Brandlight AI LTD-PayEm-SaaS and Subscriptions-5652,5 Jan 26,01-26,"($4,256)",USD,1,"($4,256)",Technology,-,"($4,256)",Yes,Serpapi,#REF!,G&A,,,5/1/2026
2026-01-06,08:07,CLEARED,NO_SYNC,Bill + Bill payment,$5.03,USD,5.03,USD,Brandlight AI LTD,517057576,,,,,,,,,,,2026-01-06,2026-01-06,,,,,0,OpenAI,SXONGQUGQWWJUTM,#ERROR!,Computer Software Stores,5734,Computer Software Stores,1,5652,Employee - Virtual,SaaS and Subscriptions,SaaS and Subscriptions,"Didi Dvash, Gal Rubin",,6274393,,,Brandlight AI LTD-PayEm-SaaS and Subscriptions-5652,6 Jan 26,01-26,($5),USD,1,($5),Technology,-,($5),,OpenAI,#REF!,G&A,,,6/1/2026
2026-01-06,08:11,CLEARED,NO_SYNC,Bill + Bill payment,$5.27,USD,5.27,USD,Brandlight AI LTD,517057576,,,,,,,,,,,2026-01-06,2026-01-06,,,,,0,OpenAI,SXONGQUGQWWJUTM,#ERROR!,Computer Software Stores,5734,Computer Software Stores,1,5652,Employee - Virtual,SaaS and Subscriptions,SaaS and Subscriptions,"Didi Dvash, Gal Rubin",,6274424,,,Brandlight AI LTD-PayEm-SaaS and Subscriptions-5652,6 Jan 26,01-26,($5),USD,1,($5),Technology,-,($5),Yes,OpenAI,#REF!,G&A,,,6/1/2026
2026-01-06,08:39,CLEARED,NO_SYNC,Bill + Bill payment,$6.44,USD,6.44,USD,Brandlight AI LTD,517057576,,,,,,,,,,,2026-01-06,2026-01-06,,,,,0,OpenAI,SXONGQUGQWWJUTM,#ERROR!,Computer Software Stores,5734,Computer Software Stores,1,5652,Employee - Virtual,SaaS and Subscriptions,SaaS and Subscriptions,"Didi Dvash, Gal Rubin",,6274548,,,Brandlight AI LTD-PayEm-SaaS and Subscriptions-5652,6 Jan 26,01-26,($6),USD,1,($6),Technology,-,($6),Yes,OpenAI,#REF!,G&A,,,6/1/2026
2026-01-06,09:40,CLEARED,NO_SYNC,Bill + Bill payment,$420.37,USD,420.37,USD,Brandlight AI LTD,517057576,,,,,,,,,,,2026-01-06,2026-01-06,,,,,0,CURSOR USAGE MID  DEC,MZJ96QO0A3SN4BD,"CURSOR.COM, USA, 10025",Computer Software Stores,5734,Computer Software Stores,1,5652,Employee - Virtual,SaaS and Subscriptions,SaaS and Subscriptions,"Didi Dvash, Gal Rubin",https://app.payemcard.com/api/transactions/6274889/receipt.pdf,6274889,,,Brandlight AI LTD-PayEm-SaaS and Subscriptions-5652,6 Jan 26,01-26,($420),USD,1,($420),Technology,-,($420),Yes,CURSOR USAGE MID  DEC,#REF!,G&A,,,6/1/2026
2026-01-06,10:41,CLEARED,NO_SYNC,Bill + Bill payment,$5.97,USD,5.97,USD,Brandlight AI LTD,517057576,,,,,,,,,,,2026-01-06,2026-01-06,,,,,0,OpenAI,SXONGQUGQWWJUTM,#ERROR!,Computer Software Stores,5734,Computer Software Stores,1,5652,Employee - Virtual,SaaS and Subscriptions,SaaS and Subscriptions,"Didi Dvash, Gal Rubin",,6275285,,,Brandlight AI LTD-PayEm-SaaS and Subscriptions-5652,6 Jan 26,01-26,($6),USD,1,($6),Technology,-,($6),Yes,OpenAI,#REF!,S&M,,,6/1/2026
2026-01-06,12:10,CLEARED,NO_SYNC,Bill + Bill payment,$5.15,USD,5.15,USD,Brandlight AI LTD,517057576,,,,,,,,,,,2026-01-06,2026-01-06,,,,,0,OpenAI,SXONGQUGQWWJUTM,#ERROR!,Computer Software Stores,5734,Computer Software Stores,1,5652,Employee - Virtual,SaaS and Subscriptions,SaaS and Subscriptions,"Didi Dvash, Gal Rubin",,6275854,,,Brandlight AI LTD-PayEm-SaaS and Subscriptions-5652,6 Jan 26,01-26,($5),USD,1,($5),Technology,-,($5),Yes,OpenAI,#REF!,S&M,,,6/1/2026
2026-01-06,12:19,CLEARED,NO_SYNC,Bill + Bill payment,$5.02,USD,5.02,USD,Brandlight AI LTD,517057576,,,,,,,,,,,2026-01-06,2026-01-06,,,,,0,OpenAI,SXONGQUGQWWJUTM,#ERROR!,Computer Software Stores,5734,Computer Software Stores,1,5652,Employee - Virtual,SaaS and Subscriptions,SaaS and Subscriptions,"Didi Dvash, Gal Rubin",,6275925,,,Brandlight AI LTD-PayEm-SaaS and Subscriptions-5652,6 Jan 26,01-26,($5),USD,1,($5),Technology,-,($5),Yes,OpenAI,#REF!,G&A,,,6/1/2026
2026-01-06,13:46,REVERSED,NO_SYNC,Bill + Bill payment,$382.38,USD,1204.5,ILS,Brandlight AI LTD,517057576,,,,,,,,,,,2026-01-06,2026-01-06,,,,,0,SUPER,569993,"RISHON LEZION, ISR, 75363",Department Stores,5311,Department Stores,0,3635,Employee - Virtual,Gal Rubin,Gal Rubin,Gal Rubin,,6276473,,,Brandlight AI LTD-PayEm-Gal Rubin-3635,6 Jan 26,01-26,($382),USD,1,($382),Refreshments & Welfare,-,($382),Yes,SUPER,#REF!,G&A,,,6/1/2026
2026-01-06,13:56,CLEARED,NO_SYNC,Bill + Bill payment,$5.28,USD,5.28,USD,Brandlight AI LTD,517057576,,,,,,,,,,,2026-01-06,2026-01-06,,,,,0,OpenAI,SXONGQUGQWWJUTM,#ERROR!,Computer Software Stores,5734,Computer Software Stores,1,5652,Employee - Virtual,SaaS and Subscriptions,SaaS and Subscriptions,"Didi Dvash, Gal Rubin",,6276536,,,Brandlight AI LTD-PayEm-SaaS and Subscriptions-5652,6 Jan 26,01-26,($5),USD,1,($5),Technology,-,($5),Yes,OpenAI,#REF!,G&A,,,6/1/2026
2026-01-06,14:14,CLEARED,NO_SYNC,Bill + Bill payment,$417.25,USD,1276.08,ILS,Brandlight AI LTD,517057576,,,,,,,,,,,2026-01-06,2026-01-06,,,,,0,SUPER,569993,"RISHON LEZION, ISR, 75363",Department Stores,5311,Department Stores,0,3635,Employee - Virtual,Gal Rubin,Gal Rubin,Gal Rubin,,6276682,,,Brandlight AI LTD-PayEm-Gal Rubin-3635,6 Jan 26,01-26,($417),USD,1,($417),Refreshments & Welfare,-,($417),Yes,SUPER,#REF!,G&A,,,6/1/2026
2026-01-06,16:22,CLEARED,NO_SYNC,Bill + Bill payment,"$1,000.00",USD,1000,USD,Brandlight Inc.,,,,,,,,,,,,2026-01-06,2026-01-06,,,,,0,CONTENT ZEN,XDGPVLEBBMZYZDL,"CONTENT-ZEN.C, USA, 10028",Computer Software Stores,5734,Computer Software Stores,0,8062,Employee - Virtual,Alex Prober,Alex - US,,https://app.payemcard.com/api/transactions/6277596/receipt.pdf,6277596,,,Brandlight Inc.-PayEm-Alex Prober-8062,6 Jan 26,01-26,"($1,000)",USD,1,"($1,000)",Tools,-,"($1,000)",Yes,CONTENT ZEN,#REF!,G&A,,,6/1/2026
2026-01-06,18:52,CLEARED,NO_SYNC,Bill + Bill payment,$57.00,USD,57,USD,Brandlight AI LTD,517057576,,,,,,,,,,,2026-01-06,2026-01-06,,,,,0,Github,KA3GP5EPWAQ7BLQ,#ERROR!,"Computer Programming, Integrated Systems Design and Data Processing Services",7372,Computer Programming,1,5652,Employee - Virtual,SaaS and Subscriptions,SaaS and Subscriptions,"Didi Dvash, Gal Rubin",https://app.payemcard.com/api/transactions/6278415/receipt.pdf,6278415,,,Brandlight AI LTD-PayEm-SaaS and Subscriptions-5652,6 Jan 26,01-26,($57),USD,1,($57),Tools,-,($57),Yes,Github,#REF!,G&A,,,6/1/2026
2026-01-06,21:19,CLEARED,NO_SYNC,Bill + Bill payment,$319.19,USD,319.19,USD,Brandlight AI LTD,517057576,,,,,,,,,,,2026-01-06,2026-01-06,,,,,0,Figma,POLKQATDE4V1NYX,#ERROR!,"Computer Programming, Integrated Systems Design and Data Processing Services",7372,Computer Programming,1,5652,Employee - Virtual,SaaS and Subscriptions,SaaS and Subscriptions,"Didi Dvash, Gal Rubin",,6279179,,,Brandlight AI LTD-PayEm-SaaS and Subscriptions-5652,6 Jan 26,01-26,($319),USD,1,($319),Tools,-,($319),Yes,Figma,#REF!,G&A,,,6/1/2026
2026-01-06,22:16,CLEARED,NO_SYNC,Bill + Bill payment,$450.43,USD,450.43,USD,Brandlight AI LTD,517057576,,,,,,,,,,,2026-01-06,2026-01-06,,,,,0,ANTHROPIC,Q0RRUWQV26H30SO,#ERROR!,Computer Software Stores,5734,Computer Software Stores,0,5652,Employee - Virtual,SaaS and Subscriptions,SaaS and Subscriptions,"Didi Dvash, Gal Rubin",,6279505,,,Brandlight AI LTD-PayEm-SaaS and Subscriptions-5652,6 Jan 26,01-26,($450),USD,1,($450),Technology,-,($450),Yes,ANTHROPIC,#REF!,G&A,,,6/1/2026
2026-01-06,23:04,CLEARED,NO_SYNC,Bill + Bill payment,"$1,000.00",USD,1000,USD,Brandlight AI LTD,517057576,,,,,,,,,,,2026-01-06,2026-01-06,,,,,0,BRIGHTDATA,9.12E+11,"412-5966371, USA, 10018",Computer Software Stores,5734,Computer Software Stores,1,5652,Employee - Virtual,SaaS and Subscriptions,SaaS and Subscriptions,"Didi Dvash, Gal Rubin",,6279700,,,Brandlight AI LTD-PayEm-SaaS and Subscriptions-5652,6 Jan 26,01-26,"($1,000)",USD,1,"($1,000)",Technology,-,"($1,000)",Yes,BRIGHTDATA,#REF!,G&A,,,6/1/2026
2026-01-07,03:36,CLEARED,NO_SYNC,Bill + Bill payment,$6.62,USD,6.62,USD,Brandlight AI LTD,517057576,,,,,,,,,,,2026-01-07,2026-01-07,,,,,0,OpenAI,SXONGQUGQWWJUTM,#ERROR!,Computer Software Stores,5734,Computer Software Stores,1,5652,Employee - Virtual,SaaS and Subscriptions,SaaS and Subscriptions,"Didi Dvash, Gal Rubin",,6280439,,,Brandlight AI LTD-PayEm-SaaS and Subscriptions-5652,7 Jan 26,01-26,($7),USD,1,($7),Technology,-,($7),Yes,OpenAI,#REF!,G&A,,,7/1/2026
2026-01-07,03:41,CLEARED,NO_SYNC,Bill + Bill payment,$5.18,USD,5.18,USD,Brandlight AI LTD,517057576,,,,,,,,,,,2026-01-07,2026-01-07,,,,,0,OpenAI,SXONGQUGQWWJUTM,#ERROR!,Computer Software Stores,5734,Computer Software Stores,1,5652,Employee - Virtual,SaaS and Subscriptions,SaaS and Subscriptions,"Didi Dvash, Gal Rubin",,6280457,,,Brandlight AI LTD-PayEm-SaaS and Subscriptions-5652,7 Jan 26,01-26,($5),USD,1,($5),Technology,-,($5),Yes,OpenAI,#REF!,G&A,,,7/1/2026
2026-01-07,03:57,CLEARED,NO_SYNC,Bill + Bill payment,$7.32,USD,7.32,USD,Brandlight AI LTD,517057576,,,,,,,,,,,2026-01-07,2026-01-07,,,,,0,OpenAI,SXONGQUGQWWJUTM,#ERROR!,Computer Software Stores,5734,Computer Software Stores,1,5652,Employee - Virtual,SaaS and Subscriptions,SaaS and Subscriptions,"Didi Dvash, Gal Rubin",,6280511,,,Brandlight AI LTD-PayEm-SaaS and Subscriptions-5652,7 Jan 26,01-26,($7),USD,1,($7),Technology,-,($7),Yes,OpenAI,#REF!,G&A,,,7/1/2026
2026-01-07,04:01,CLEARED,NO_SYNC,Bill + Bill payment,$5.81,USD,5.81,USD,Brandlight AI LTD,517057576,,,,,,,,,,,2026-01-07,2026-01-07,,,,,0,OpenAI,SXONGQUGQWWJUTM,#ERROR!,Computer Software Stores,5734,Computer Software Stores,1,5652,Employee - Virtual,SaaS and Subscriptions,SaaS and Subscriptions,"Didi Dvash, Gal Rubin",,6280525,,,Brandlight AI LTD-PayEm-SaaS and Subscriptions-5652,7 Jan 26,01-26,($6),USD,1,($6),Technology,-,($6),Yes,OpenAI,#REF!,S&M,,,7/1/2026
2026-01-07,04:20,CLEARED,NO_SYNC,Bill + Bill payment,$5.72,USD,5.72,USD,Brandlight AI LTD,517057576,,,,,,,,,,,2026-01-07,2026-01-07,,,,,0,OpenAI,SXONGQUGQWWJUTM,#ERROR!,Computer Software Stores,5734,Computer Software Stores,1,5652,Employee - Virtual,SaaS and Subscriptions,SaaS and Subscriptions,"Didi Dvash, Gal Rubin",,6280568,,,Brandlight AI LTD-PayEm-SaaS and Subscriptions-5652,7 Jan 26,01-26,($6),USD,1,($6),Technology,-,($6),Yes,OpenAI,#REF!,G&A,,,7/1/2026
2026-01-07,04:22,CLEARED,NO_SYNC,Bill + Bill payment,$6.56,USD,6.56,USD,Brandlight AI LTD,517057576,,,,,,,,,,,2026-01-07,2026-01-07,,,,,0,OpenAI,SXONGQUGQWWJUTM,#ERROR!,Computer Software Stores,5734,Computer Software Stores,1,5652,Employee - Virtual,SaaS and Subscriptions,SaaS and Subscriptions,"Didi Dvash, Gal Rubin",,6280572,,,Brandlight AI LTD-PayEm-SaaS and Subscriptions-5652,7 Jan 26,01-26,($7),USD,1,($7),Technology,-,($7),Yes,OpenAI,#REF!,G&A,,,7/1/2026
2026-01-07,04:36,CLEARED,NO_SYNC,Bill + Bill payment,$5.45,USD,5.45,USD,Brandlight AI LTD,517057576,,,,,,,,,,,2026-01-07,2026-01-07,,,,,0,OpenAI,SXONGQUGQWWJUTM,#ERROR!,Computer Software Stores,5734,Computer Software Stores,1,5652,Employee - Virtual,SaaS and Subscriptions,SaaS and Subscriptions,"Didi Dvash, Gal Rubin",,6280606,,,Brandlight AI LTD-PayEm-SaaS and Subscriptions-5652,7 Jan 26,01-26,($5),USD,1,($5),Technology,-,($5),Yes,OpenAI,#REF!,G&A,,,7/1/2026
2026-01-07,04:41,CLEARED,NO_SYNC,Bill + Bill payment,$6.98,USD,6.98,USD,Brandlight AI LTD,517057576,,,,,,,,,,,2026-01-07,2026-01-07,,,,,0,OpenAI,SXONGQUGQWWJUTM,#ERROR!,Computer Software Stores,5734,Computer Software Stores,1,5652,Employee - Virtual,SaaS and Subscriptions,SaaS and Subscriptions,"Didi Dvash, Gal Rubin",,6280634,,,Brandlight AI LTD-PayEm-SaaS and Subscriptions-5652,7 Jan 26,01-26,($7),USD,1,($7),Technology,-,($7),Yes,OpenAI,#REF!,S&M,,,7/1/2026
2026-01-07,04:53,CLEARED,NO_SYNC,Bill + Bill payment,$6.47,USD,6.47,USD,Brandlight AI LTD,517057576,,,,,,,,,,,2026-01-07,2026-01-07,,,,,0,OpenAI,SXONGQUGQWWJUTM,#ERROR!,Computer Software Stores,5734,Computer Software Stores,1,5652,Employee - Virtual,SaaS and Subscriptions,SaaS and Subscriptions,"Didi Dvash, Gal Rubin",,6280670,,,Brandlight AI LTD-PayEm-SaaS and Subscriptions-5652,7 Jan 26,01-26,($6),USD,1,($6),Technology,-,($6),Yes,OpenAI,#REF!,G&A,,,7/1/2026
2026-01-07,05:02,CLEARED,NO_SYNC,Bill + Bill payment,$6.60,USD,6.6,USD,Brandlight AI LTD,517057576,,,,,,,,,,,2026-01-07,2026-01-07,,,,,0,OpenAI,SXONGQUGQWWJUTM,#ERROR!,Computer Software Stores,5734,Computer Software Stores,1,5652,Employee - Virtual,SaaS and Subscriptions,SaaS and Subscriptions,"Didi Dvash, Gal Rubin",,6280708,,,Brandlight AI LTD-PayEm-SaaS and Subscriptions-5652,7 Jan 26,01-26,($7),USD,1,($7),Technology,-,($7),Yes,OpenAI,#REF!,G&A,,,7/1/2026
2026-01-07,05:10,CLEARED,NO_SYNC,Bill + Bill payment,$6.21,USD,6.21,USD,Brandlight AI LTD,517057576,,,,,,,,,,,2026-01-07,2026-01-07,,,,,0,OpenAI,SXONGQUGQWWJUTM,#ERROR!,Computer Software Stores,5734,Computer Software Stores,1,5652,Employee - Virtual,SaaS and Subscriptions,SaaS and Subscriptions,"Didi Dvash, Gal Rubin",,6280735,,,Brandlight AI LTD-PayEm-SaaS and Subscriptions-5652,7 Jan 26,01-26,($6),USD,1,($6),Technology,-,($6),Yes,OpenAI,#REF!,G&A,,,7/1/2026
2026-01-07,05:24,CLEARED,NO_SYNC,Bill + Bill payment,$6.74,USD,6.74,USD,Brandlight AI LTD,517057576,,,,,,,,,,,2026-01-07,2026-01-07,,,,,0,OpenAI,SXONGQUGQWWJUTM,#ERROR!,Computer Software Stores,5734,Computer Software Stores,1,5652,Employee - Virtual,SaaS and Subscriptions,SaaS and Subscriptions,"Didi Dvash, Gal Rubin",,6280783,,,Brandlight AI LTD-PayEm-SaaS and Subscriptions-5652,7 Jan 26,01-26,($7),USD,1,($7),Technology,-,($7),Yes,OpenAI,#REF!,G&A,,,7/1/2026
2026-01-07,05:27,CLEARED,NO_SYNC,Bill + Bill payment,$5.91,USD,5.91,USD,Brandlight AI LTD,517057576,,,,,,,,,,,2026-01-07,2026-01-07,,,,,0,OpenAI,SXONGQUGQWWJUTM,#ERROR!,Computer Software Stores,5734,Computer Software Stores,1,5652,Employee - Virtual,SaaS and Subscriptions,SaaS and Subscriptions,"Didi Dvash, Gal Rubin",,6280800,,,Brandlight AI LTD-PayEm-SaaS and Subscriptions-5652,7 Jan 26,01-26,($6),USD,1,($6),Technology,-,($6),Yes,OpenAI,#REF!,G&A,,,7/1/2026
2026-01-07,05:40,CLEARED,NO_SYNC,Bill + Bill payment,$5.51,USD,5.51,USD,Brandlight AI LTD,517057576,,,,,,,,,,,2026-01-07,2026-01-07,,,,,0,OpenAI,SXONGQUGQWWJUTM,#ERROR!,Computer Software Stores,5734,Computer Software Stores,1,5652,Employee - Virtual,SaaS and Subscriptions,SaaS and Subscriptions,"Didi Dvash, Gal Rubin",,6280837,,,Brandlight AI LTD-PayEm-SaaS and Subscriptions-5652,7 Jan 26,01-26,($6),USD,1,($6),Technology,-,($6),Yes,OpenAI,#REF!,G&A,,,7/1/2026
2026-01-07,05:47,CLEARED,NO_SYNC,Bill + Bill payment,$5.72,USD,5.72,USD,Brandlight AI LTD,517057576,,,,,,,,,,,2026-01-07,2026-01-07,,,,,0,OpenAI,SXONGQUGQWWJUTM,#ERROR!,Computer Software Stores,5734,Computer Software Stores,1,5652,Employee - Virtual,SaaS and Subscriptions,SaaS and Subscriptions,"Didi Dvash, Gal Rubin",,6280867,,,Brandlight AI LTD-PayEm-SaaS and Subscriptions-5652,7 Jan 26,01-26,($6),USD,1,($6),Technology,-,($6),Yes,OpenAI,#REF!,G&A,,,7/1/2026
2026-01-07,05:58,CLEARED,NO_SYNC,Bill + Bill payment,$6.07,USD,6.07,USD,Brandlight AI LTD,517057576,,,,,,,,,,,2026-01-07,2026-01-07,,,,,0,OpenAI,SXONGQUGQWWJUTM,#ERROR!,Computer Software Stores,5734,Computer Software Stores,1,5652,Employee - Virtual,SaaS and Subscriptions,SaaS and Subscriptions,"Didi Dvash, Gal Rubin",,6280907,,,Brandlight AI LTD-PayEm-SaaS and Subscriptions-5652,7 Jan 26,01-26,($6),USD,1,($6),Technology,-,($6),Yes,OpenAI,#REF!,G&A,,,7/1/2026
2026-01-07,06:05,CLEARED,NO_SYNC,Bill + Bill payment,$5.40,USD,5.4,USD,Brandlight AI LTD,517057576,,,,,,,,,,,2026-01-07,2026-01-07,,,,,0,OpenAI,SXONGQUGQWWJUTM,#ERROR!,Computer Software Stores,5734,Computer Software Stores,1,5652,Employee - Virtual,SaaS and Subscriptions,SaaS and Subscriptions,"Didi Dvash, Gal Rubin",,6280924,,,Brandlight AI LTD-PayEm-SaaS and Subscriptions-5652,7 Jan 26,01-26,($5),USD,1,($5),Technology,-,($5),Yes,OpenAI,#REF!,G&A,,,7/1/2026
2026-01-07,06:16,CLEARED,NO_SYNC,Bill + Bill payment,$5.97,USD,5.97,USD,Brandlight AI LTD,517057576,,,,,,,,,,,2026-01-07,2026-01-07,,,,,0,OpenAI,SXONGQUGQWWJUTM,#ERROR!,Computer Software Stores,5734,Computer Software Stores,1,5652,Employee - Virtual,SaaS and Subscriptions,SaaS and Subscriptions,"Didi Dvash, Gal Rubin",,6280957,,,Brandlight AI LTD-PayEm-SaaS and Subscriptions-5652,7 Jan 26,01-26,($6),USD,1,($6),Technology,-,($6),Yes,OpenAI,#REF!,G&A,,,7/1/2026
2026-01-07,06:23,CLEARED,NO_SYNC,Bill + Bill payment,$5.60,USD,5.6,USD,Brandlight AI LTD,517057576,,,,,,,,,,,2026-01-07,2026-01-07,,,,,0,OpenAI,SXONGQUGQWWJUTM,#ERROR!,Computer Software Stores,5734,Computer Software Stores,1,5652,Employee - Virtual,SaaS and Subscriptions,SaaS and Subscriptions,"Didi Dvash, Gal Rubin",,6280986,,,Brandlight AI LTD-PayEm-SaaS and Subscriptions-5652,7 Jan 26,01-26,($6),USD,1,($6),Technology,-,($6),Yes,OpenAI,#REF!,S&M,,,7/1/2026
2026-01-07,06:36,CLEARED,NO_SYNC,Bill + Bill payment,$5.07,USD,5.07,USD,Brandlight AI LTD,517057576,,,,,,,,,,,2026-01-07,2026-01-07,,,,,0,OpenAI,SXONGQUGQWWJUTM,#ERROR!,Computer Software Stores,5734,Computer Software Stores,1,5652,Employee - Virtual,SaaS and Subscriptions,SaaS and Subscriptions,"Didi Dvash, Gal Rubin",,6281031,,,Brandlight AI LTD-PayEm-SaaS and Subscriptions-5652,7 Jan 26,01-26,($5),USD,1,($5),Technology,-,($5),Yes,OpenAI,#REF!,G&A,,,7/1/2026
2026-01-07,06:37,CLEARED,NO_SYNC,Bill + Bill payment,$5.89,USD,5.89,USD,Brandlight AI LTD,517057576,,,,,,,,,,,2026-01-07,2026-01-07,,,,,0,OpenAI,SXONGQUGQWWJUTM,#ERROR!,Computer Software Stores,5734,Computer Software Stores,1,5652,Employee - Virtual,SaaS and Subscriptions,SaaS and Subscriptions,"Didi Dvash, Gal Rubin",,6281032,,,Brandlight AI LTD-PayEm-SaaS and Subscriptions-5652,7 Jan 26,01-26,($6),USD,1,($6),Technology,-,($6),Yes,OpenAI,#REF!,G&A,,,7/1/2026
2026-01-07,06:53,CLEARED,NO_SYNC,Bill + Bill payment,$5.21,USD,5.21,USD,Brandlight AI LTD,517057576,,,,,,,,,,,2026-01-07,2026-01-07,,,,,0,OpenAI,SXONGQUGQWWJUTM,#ERROR!,Computer Software Stores,5734,Computer Software Stores,1,5652,Employee - Virtual,SaaS and Subscriptions,SaaS and Subscriptions,"Didi Dvash, Gal Rubin",,6281092,,,Brandlight AI LTD-PayEm-SaaS and Subscriptions-5652,7 Jan 26,01-26,($5),USD,1,($5),Technology,-,($5),Yes,OpenAI,#REF!,G&A,,,7/1/2026
2026-01-07,06:54,CLEARED,NO_SYNC,Bill + Bill payment,$6.25,USD,6.25,USD,Brandlight AI LTD,517057576,,,,,,,,,,,2026-01-07,2026-01-07,,,,,0,OpenAI,SXONGQUGQWWJUTM,#ERROR!,Computer Software Stores,5734,Computer Software Stores,1,5652,Employee - Virtual,SaaS and Subscriptions,SaaS and Subscriptions,"Didi Dvash, Gal Rubin",,6281093,,,Brandlight AI LTD-PayEm-SaaS and Subscriptions-5652,7 Jan 26,01-26,($6),USD,1,($6),Technology,-,($6),Yes,OpenAI,#REF!,G&A,,,7/1/2026
2026-01-07,07:11,CLEARED,NO_SYNC,Bill + Bill payment,$5.67,USD,5.67,USD,Brandlight AI LTD,517057576,,,,,,,,,,,2026-01-07,2026-01-07,,,,,0,OpenAI,SXONGQUGQWWJUTM,#ERROR!,Computer Software Stores,5734,Computer Software Stores,1,5652,Employee - Virtual,SaaS and Subscriptions,SaaS and Subscriptions,"Didi Dvash, Gal Rubin",,6281189,,,Brandlight AI LTD-PayEm-SaaS and Subscriptions-5652,7 Jan 26,01-26,($6),USD,1,($6),Technology,-,($6),Yes,OpenAI,#REF!,G&A,,,7/1/2026
2026-01-07,07:15,CLEARED,NO_SYNC,Bill + Bill payment,$5.88,USD,5.88,USD,Brandlight AI LTD,517057576,,,,,,,,,,,2026-01-07,2026-01-07,,,,,0,OpenAI,SXONGQUGQWWJUTM,#ERROR!,Computer Software Stores,5734,Computer Software Stores,1,5652,Employee - Virtual,SaaS and Subscriptions,SaaS and Subscriptions,"Didi Dvash, Gal Rubin",,6281215,,,Brandlight AI LTD-PayEm-SaaS and Subscriptions-5652,7 Jan 26,01-26,($6),USD,1,($6),Technology,-,($6),Yes,OpenAI,#REF!,G&A,,,7/1/2026
2026-01-07,07:28,CLEARED,NO_SYNC,Bill + Bill payment,$5.89,USD,5.89,USD,Brandlight AI LTD,517057576,,,,,,,,,,,2026-01-07,2026-01-07,,,,,0,OpenAI,SXONGQUGQWWJUTM,#ERROR!,Computer Software Stores,5734,Computer Software Stores,1,5652,Employee - Virtual,SaaS and Subscriptions,SaaS and Subscriptions,"Didi Dvash, Gal Rubin",,6281310,,,Brandlight AI LTD-PayEm-SaaS and Subscriptions-5652,7 Jan 26,01-26,($6),USD,1,($6),Technology,-,($6),Yes,OpenAI,#REF!,G&A,,,7/1/2026
2026-01-07,07:34,CLEARED,NO_SYNC,Bill + Bill payment,$5.69,USD,5.69,USD,Brandlight AI LTD,517057576,,,,,,,,,,,2026-01-07,2026-01-07,,,,,0,OpenAI,SXONGQUGQWWJUTM,#ERROR!,Computer Software Stores,5734,Computer Software Stores,1,5652,Employee - Virtual,SaaS and Subscriptions,SaaS and Subscriptions,"Didi Dvash, Gal Rubin",,6281344,,,Brandlight AI LTD-PayEm-SaaS and Subscriptions-5652,7 Jan 26,01-26,($6),USD,1,($6),Technology,-,($6),Yes,OpenAI,#REF!,G&A,,,7/1/2026
2026-01-07,07:38,CLEARED,NO_SYNC,Bill + Bill payment,$600.00,USD,600,USD,Brandlight AI LTD,517057576,,,,,,,,,,,2026-01-07,2026-01-07,,,,,0,OpenAI,SXONGQUGQWWJUTM,#ERROR!,Computer Software Stores,5734,Computer Software Stores,1,5883,Employee - Virtual,Aviv Zaken,Aviv Zaken,,,6281360,,,Brandlight AI LTD-PayEm-Aviv Zaken-5883,7 Jan 26,01-26,($600),USD,1,($600),Technology,-,($600),Yes,OpenAI,#REF!,G&A,,,7/1/2026
2026-01-07,07:40,CLEARED,NO_SYNC,Bill + Bill payment,$950.00,USD,950,USD,Brandlight AI LTD,517057576,,,,,,,,,,,2026-01-07,2026-01-07,,,,,0,OpenAI,SXONGQUGQWWJUTM,#ERROR!,Computer Software Stores,5734,Computer Software Stores,1,5883,Employee - Virtual,Aviv Zaken,Aviv Zaken,,,6281378,,,Brandlight AI LTD-PayEm-Aviv Zaken-5883,7 Jan 26,01-26,($950),USD,1,($950),Technology,-,($950),Yes,OpenAI,#REF!,G&A,,,7/1/2026
2026-01-07,07:44,CLEARED,NO_SYNC,Bill + Bill payment,$950.00,USD,950,USD,Brandlight AI LTD,517057576,,,,,,,,,,,2026-01-07,2026-01-07,,,,,0,OpenAI,SXONGQUGQWWJUTM,#ERROR!,Computer Software Stores,5734,Computer Software Stores,1,5883,Employee - Virtual,Aviv Zaken,Aviv Zaken,,,6281401,,,Brandlight AI LTD-PayEm-Aviv Zaken-5883,7 Jan 26,01-26,($950),USD,1,($950),Technology,-,($950),Yes,OpenAI,#REF!,G&A,,,7/1/2026
2026-01-07,07:46,CLEARED,NO_SYNC,Bill + Bill payment,$950.00,USD,950,USD,Brandlight AI LTD,517057576,,,,,,,,,,,2026-01-07,2026-01-07,,,,,0,OpenAI,SXONGQUGQWWJUTM,#ERROR!,Computer Software Stores,5734,Computer Software Stores,1,5883,Employee - Virtual,Aviv Zaken,Aviv Zaken,,,6281414,,,Brandlight AI LTD-PayEm-Aviv Zaken-5883,7 Jan 26,01-26,($950),USD,1,($950),Technology,-,($950),Yes,OpenAI,#REF!,G&A,,,7/1/2026
2026-01-07,09:42,CLEARED,NO_SYNC,Bill + Bill payment,"$7,500.00",USD,7500,USD,Brandlight AI LTD,517057576,,,,,,,,,,,2026-01-07,2026-01-07,,,,,0,OpenAI,SXONGQUGQWWJUTM,#ERROR!,Computer Software Stores,5734,Computer Software Stores,0,5883,Employee - Virtual,Aviv Zaken,Aviv Zaken,,,6282019,,,Brandlight AI LTD-PayEm-Aviv Zaken-5883,7 Jan 26,01-26,"($7,500)",USD,1,"($7,500)",Technology,-,"($7,500)",Yes,OpenAI,#REF!,G&A,,,7/1/2026
2026-01-07,09:43,CLEARED,NO_SYNC,Bill + Bill payment,"$9,500.00",USD,9500,USD,Brandlight AI LTD,517057576,,,,,,,,,,,2026-01-07,2026-01-07,,,,,0,OpenAI,SXONGQUGQWWJUTM,#ERROR!,Computer Software Stores,5734,Computer Software Stores,0,5883,Employee - Virtual,Aviv Zaken,Aviv Zaken,,,6282026,,,Brandlight AI LTD-PayEm-Aviv Zaken-5883,7 Jan 26,01-26,"($9,500)",USD,1,"($9,500)",Technology,-,"($9,500)",Yes,OpenAI,#REF!,G&A,,,7/1/2026
2026-01-07,10:44,CLEARED,NO_SYNC,Bill + Bill payment,$6.92,USD,6.92,USD,Brandlight AI LTD,517057576,,,,,,,,,,,2026-01-07,2026-01-07,,,,,0,OpenAI,SXONGQUGQWWJUTM,#ERROR!,Computer Software Stores,5734,Computer Software Stores,1,5652,Employee - Virtual,SaaS and Subscriptions,SaaS and Subscriptions,"Didi Dvash, Gal Rubin",,6282374,,,Brandlight AI LTD-PayEm-SaaS and Subscriptions-5652,7 Jan 26,01-26,($7),USD,1,($7),Technology,-,($7),Yes,OpenAI,#REF!,S&M,,,7/1/2026
2026-01-07,13:08,CLEARED,NO_SYNC,Bill + Bill payment,$5.96,USD,5.96,USD,Brandlight AI LTD,517057576,,,,,,,,,,,2026-01-07,2026-01-07,,,,,0,OpenAI,SXONGQUGQWWJUTM,#ERROR!,Computer Software Stores,5734,Computer Software Stores,1,5652,Employee - Virtual,SaaS and Subscriptions,SaaS and Subscriptions,"Didi Dvash, Gal Rubin",,6283258,,,Brandlight AI LTD-PayEm-SaaS and Subscriptions-5652,7 Jan 26,01-26,($6),USD,1,($6),Technology,-,($6),Yes,OpenAI,#REF!,G&A,,,7/1/2026
2026-01-07,13:21,CLEARED,NO_SYNC,Bill + Bill payment,$5.03,USD,5.03,USD,Brandlight AI LTD,517057576,,,,,,,,,,,2026-01-07,2026-01-07,,,,,0,OpenAI,SXONGQUGQWWJUTM,#ERROR!,Computer Software Stores,5734,Computer Software Stores,1,5652,Employee - Virtual,SaaS and Subscriptions,SaaS and Subscriptions,"Didi Dvash, Gal Rubin",,6283337,,,Brandlight AI LTD-PayEm-SaaS and Subscriptions-5652,7 Jan 26,01-26,($5),USD,1,($5),Technology,-,($5),Yes,OpenAI,#REF!,S&M,,,7/1/2026
2026-01-07,19:18,CLEARED,NO_SYNC,Bill + Bill payment,$560.01,USD,560.01,USD,Brandlight AI LTD,517057576,,,,,,,,,,,2026-01-07,2026-01-07,,,,,0,Cursor,MZJ96QO0A3SN4BD,#ERROR!,Computer Software Stores,5734,Computer Software Stores,1,5652,Employee - Virtual,SaaS and Subscriptions,SaaS and Subscriptions,"Didi Dvash, Gal Rubin",https://app.payemcard.com/api/transactions/6285712/receipt.pdf,6285712,,,Brandlight AI LTD-PayEm-SaaS and Subscriptions-5652,7 Jan 26,01-26,($560),USD,1,($560),Technology,-,($560),Yes,Cursor,#REF!,R&D,,,7/1/2026
2026-01-07,21:22,CLEARED,NO_SYNC,Bill + Bill payment,$7.60,USD,7.6,USD,Brandlight AI LTD,517057576,,,,,,,,,,,2026-01-07,2026-01-07,,,,,0,OpenAI,SXONGQUGQWWJUTM,#ERROR!,Computer Software Stores,5734,Computer Software Stores,1,5652,Employee - Virtual,SaaS and Subscriptions,SaaS and Subscriptions,"Didi Dvash, Gal Rubin",,6286356,,,Brandlight AI LTD-PayEm-SaaS and Subscriptions-5652,7 Jan 26,01-26,($8),USD,1,($8),Technology,-,($8),Yes,OpenAI,#REF!,G&A,,,7/1/2026
2026-01-07,21:47,CLEARED,NO_SYNC,Bill + Bill payment,$6.89,USD,6.89,USD,Brandlight AI LTD,517057576,,,,,,,,,,,2026-01-07,2026-01-07,,,,,0,OpenAI,SXONGQUGQWWJUTM,#ERROR!,Computer Software Stores,5734,Computer Software Stores,1,5652,Employee - Virtual,SaaS and Subscriptions,SaaS and Subscriptions,"Didi Dvash, Gal Rubin",,6286479,,,Brandlight AI LTD-PayEm-SaaS and Subscriptions-5652,7 Jan 26,01-26,($7),USD,1,($7),Technology,-,($7),Yes,OpenAI,#REF!,G&A,,,7/1/2026
2026-01-07,21:54,CLEARED,NO_SYNC,Bill + Bill payment,$452.38,USD,452.38,USD,Brandlight AI LTD,517057576,,,,,,,,,,,2026-01-07,2026-01-07,,,,,0,ANTHROPIC,Q0RRUWQV26H30SO,#ERROR!,Computer Software Stores,5734,Computer Software Stores,0,5652,Employee - Virtual,SaaS and Subscriptions,SaaS and Subscriptions,"Didi Dvash, Gal Rubin",,6286512,,,Brandlight AI LTD-PayEm-SaaS and Subscriptions-5652,7 Jan 26,01-26,($452),USD,1,($452),Technology,-,($452),Yes,ANTHROPIC,#REF!,G&A,,,7/1/2026
2026-01-07,23:53,CLEARED,NO_SYNC,Bill + Bill payment,"$1,000.00",USD,1000,USD,Brandlight AI LTD,517057576,,,,,,,,,,,2026-01-07,2026-01-07,,,,,0,BRIGHTDATA,9.12E+11,"412-5966371, USA, 10018",Computer Software Stores,5734,Computer Software Stores,1,5652,Employee - Virtual,SaaS and Subscriptions,SaaS and Subscriptions,"Didi Dvash, Gal Rubin",,6286914,,,Brandlight AI LTD-PayEm-SaaS and Subscriptions-5652,7 Jan 26,01-26,"($1,000)",USD,1,"($1,000)",Technology,-,"($1,000)",Yes,BRIGHTDATA,#REF!,G&A,,,7/1/2026
2026-01-08,07:40,CLEARED,NO_SYNC,Bill + Bill payment,$5.89,USD,5.89,USD,Brandlight AI LTD,517057576,,,,,,,,,,,2026-01-08,2026-01-08,,,,,0,OpenAI,SXONGQUGQWWJUTM,#ERROR!,Computer Software Stores,5734,Computer Software Stores,1,5652,Employee - Virtual,SaaS and Subscriptions,SaaS and Subscriptions,"Didi Dvash, Gal Rubin",,6288568,,,Brandlight AI LTD-PayEm-SaaS and Subscriptions-5652,8 Jan 26,01-26,($6),USD,1,($6),Technology,-,($6),Yes,OpenAI,#REF!,G&A,,,8/1/2026
2026-01-08,10:10,CLEARED,NO_SYNC,Bill + Bill payment,$5.11,USD,5.11,USD,Brandlight AI LTD,517057576,,,,,,,,,,,2026-01-08,2026-01-08,,,,,0,OpenAI,SXONGQUGQWWJUTM,#ERROR!,Computer Software Stores,5734,Computer Software Stores,1,5652,Employee - Virtual,SaaS and Subscriptions,SaaS and Subscriptions,"Didi Dvash, Gal Rubin",,6289402,,,Brandlight AI LTD-PayEm-SaaS and Subscriptions-5652,8 Jan 26,01-26,($5),USD,1,($5),Technology,-,($5),Yes,OpenAI,#REF!,G&A,,,8/1/2026
2026-01-08,11:04,CLEARED,NO_SYNC,Bill + Bill payment,$65.16,USD,200,ILS,Brandlight AI LTD,517057576,,,,,,,,,,,2026-01-08,2026-01-08,,,,,0,JOY,1.66E+06,"PETAH TIKVA, ISR, 00000","Card Shops, Gift, Novelty, and Souvenir Shops",5947,"Gift, Card, Novelty, and Souvenir Shops",0,5483,Employee - Virtual,Hila Haliva,Hila Haliva,,https://app.payemcard.com/api/transactions/6289739/receipt.pdf,6289739,,,Brandlight AI LTD-PayEm-Hila Haliva-5483,8 Jan 26,01-26,($65),USD,1,($65),#N/A,-,($65),#N/A,JOY,#REF!,G&A,#N/A,#N/A,8/1/2026
2026-01-08,13:58,CLEARED,NO_SYNC,Bill + Bill payment,$187.92,USD,151.45,EUR,Brandlight AI LTD,517057576,,,,,,,,January,,,2026-01-08,2026-01-08,,,,,0,UPS,4.99E+14,"Milano, ITA, 00000","Courier Services – Air or Ground, Freight forwarders",4215,Courier Services,0,5483,Employee - Virtual,Hila Haliva,Hila Haliva,,,6437909,,,Brandlight AI LTD-PayEm-Hila Haliva-5483,8 Jan 26,01-26,($188),USD,1,($188),Postage & Courier,-,($188),Yes,UPS,#REF!,G&A,,,8/1/2026
2026-01-08,13:58,REVERSED,NO_SYNC,Bill + Bill payment,$177.61,USD,151.75,EUR,Brandlight AI LTD,517057576,,,,,,,,,,,2026-01-08,2026-01-08,,,,,0,UPS,4.99E+14,"Milano, ITA, 00000","Courier Services – Air or Ground, Freight forwarders",4215,Courier Services,0,5483,Employee - Virtual,Hila Haliva,Hila Haliva,,,6290902,,,Brandlight AI LTD-PayEm-Hila Haliva-5483,8 Jan 26,01-26,($178),USD,1,($178),Postage & Courier,-,($178),Yes,UPS,#REF!,G&A,,,8/1/2026
2026-01-08,20:16,CLEARED,NO_SYNC,Bill + Bill payment,"$5,000.00",USD,5000,USD,Brandlight AI LTD,517057576,,,,,,,,,,,2026-01-08,2026-01-08,,,,,0,OpenAI,SXONGQUGQWWJUTM,#ERROR!,Computer Software Stores,5734,Computer Software Stores,0,5883,Employee - Virtual,Aviv Zaken,Aviv Zaken,,,6293285,,,Brandlight AI LTD-PayEm-Aviv Zaken-5883,8 Jan 26,01-26,"($5,000)",USD,1,"($5,000)",Technology,-,"($5,000)",Yes,OpenAI,#REF!,S&M,,,8/1/2026
2026-01-08,20:25,CLEARED,NO_SYNC,Bill + Bill payment,$500.00,USD,500,USD,Brandlight AI LTD,517057576,,,,,,,,,,,2026-01-08,2026-01-08,,,,,0,OpenAI,SXONGQUGQWWJUTM,#ERROR!,Computer Software Stores,5734,Computer Software Stores,1,5883,Employee - Virtual,Aviv Zaken,Aviv Zaken,,,6293336,,,Brandlight AI LTD-PayEm-Aviv Zaken-5883,8 Jan 26,01-26,($500),USD,1,($500),Technology,-,($500),Yes,OpenAI,#REF!,G&A,,,8/1/2026
2026-01-08,21:14,CLEARED,NO_SYNC,Bill + Bill payment,$451.64,USD,451.64,USD,Brandlight AI LTD,517057576,,,,,,,,,,,2026-01-08,2026-01-08,,,,,0,ANTHROPIC,Q0RRUWQV26H30SO,#ERROR!,Computer Software Stores,5734,Computer Software Stores,0,5652,Employee - Virtual,SaaS and Subscriptions,SaaS and Subscriptions,"Didi Dvash, Gal Rubin",,6293562,,,Brandlight AI LTD-PayEm-SaaS and Subscriptions-5652,8 Jan 26,01-26,($452),USD,1,($452),Technology,-,($452),Yes,ANTHROPIC,#REF!,S&M,,,8/1/2026
2026-01-08,21:45,CLEARED,NO_SYNC,Bill + Bill payment,"$1,000.00",USD,1000,USD,Brandlight AI LTD,517057576,,,,,,,,,,,2026-01-08,2026-01-08,,,,,0,BRIGHTDATA,9.12E+11,"412-5966371, USA, 10018",Computer Software Stores,5734,Computer Software Stores,1,5652,Employee - Virtual,SaaS and Subscriptions,SaaS and Subscriptions,"Didi Dvash, Gal Rubin",,6293717,,,Brandlight AI LTD-PayEm-SaaS and Subscriptions-5652,8 Jan 26,01-26,"($1,000)",USD,1,"($1,000)",Technology,-,"($1,000)",Yes,BRIGHTDATA,#REF!,G&A,,,8/1/2026
2026-01-08,22:19,CLEARED,NO_SYNC,Bill + Bill payment,$6.10,USD,6.1,USD,Brandlight AI LTD,517057576,,,,,,,,,,,2026-01-08,2026-01-08,,,,,0,OpenAI,SXONGQUGQWWJUTM,#ERROR!,Computer Software Stores,5734,Computer Software Stores,1,5652,Employee - Virtual,SaaS and Subscriptions,SaaS and Subscriptions,"Didi Dvash, Gal Rubin",,6293870,,,Brandlight AI LTD-PayEm-SaaS and Subscriptions-5652,8 Jan 26,01-26,($6),USD,1,($6),Technology,-,($6),Yes,OpenAI,#REF!,G&A,,,8/1/2026
2026-01-08,22:23,CLEARED,NO_SYNC,Bill + Bill payment,$5.74,USD,5.74,USD,Brandlight AI LTD,517057576,,,,,,,,,,,2026-01-08,2026-01-08,,,,,0,OpenAI,SXONGQUGQWWJUTM,#ERROR!,Computer Software Stores,5734,Computer Software Stores,1,5652,Employee - Virtual,SaaS and Subscriptions,SaaS and Subscriptions,"Didi Dvash, Gal Rubin",,6293887,,,Brandlight AI LTD-PayEm-SaaS and Subscriptions-5652,8 Jan 26,01-26,($6),USD,1,($6),Technology,-,($6),Yes,OpenAI,#REF!,G&A,,,8/1/2026
2026-01-08,22:26,CLEARED,NO_SYNC,Bill + Bill payment,$6.18,USD,6.18,USD,Brandlight AI LTD,517057576,,,,,,,,,,,2026-01-08,2026-01-08,,,,,0,OpenAI,SXONGQUGQWWJUTM,#ERROR!,Computer Software Stores,5734,Computer Software Stores,1,5652,Employee - Virtual,SaaS and Subscriptions,SaaS and Subscriptions,"Didi Dvash, Gal Rubin",,6293901,,,Brandlight AI LTD-PayEm-SaaS and Subscriptions-5652,8 Jan 26,01-26,($6),USD,1,($6),Technology,-,($6),Yes,OpenAI,#REF!,G&A,,,8/1/2026
2026-01-08,22:32,CLEARED,NO_SYNC,Bill + Bill payment,$10.24,USD,10.24,USD,Brandlight AI LTD,517057576,,,,,,,,,,,2026-01-08,2026-01-08,,,,,0,OpenAI,SXONGQUGQWWJUTM,#ERROR!,Computer Software Stores,5734,Computer Software Stores,1,5652,Employee - Virtual,SaaS and Subscriptions,SaaS and Subscriptions,"Didi Dvash, Gal Rubin",,6293925,,,Brandlight AI LTD-PayEm-SaaS and Subscriptions-5652,8 Jan 26,01-26,($10),USD,1,($10),Technology,-,($10),Yes,OpenAI,#REF!,S&M,,,8/1/2026
2026-01-08,22:35,CLEARED,NO_SYNC,Bill + Bill payment,$5.50,USD,5.5,USD,Brandlight AI LTD,517057576,,,,,,,,,,,2026-01-08,2026-01-08,,,,,0,OpenAI,SXONGQUGQWWJUTM,#ERROR!,Computer Software Stores,5734,Computer Software Stores,1,5652,Employee - Virtual,SaaS and Subscriptions,SaaS and Subscriptions,"Didi Dvash, Gal Rubin",,6293947,,,Brandlight AI LTD-PayEm-SaaS and Subscriptions-5652,8 Jan 26,01-26,($6),USD,1,($6),Technology,-,($6),Yes,OpenAI,#REF!,G&A,,,8/1/2026
2026-01-08,23:27,CLEARED,NO_SYNC,Bill + Bill payment,$390.00,USD,390,USD,Brandlight Inc.,,,,,,,,,,,,2026-01-08,2026-01-08,,,,,0,Dropbox,KNHVZFCKOOOUVZE,#ERROR!,Computer Software Stores,5734,Computer Software Stores,1,5106,Employee - Virtual,Imri Marcus,Imri - US,,,6294154,,,Brandlight Inc.-PayEm-Imri Marcus-5106,8 Jan 26,01-26,($390),USD,1,($390),Tools,-,($390),Yes,Dropbox,#REF!,G&A,,,8/1/2026
2026-01-09,05:12,CLEARED,NO_SYNC,Bill + Bill payment,$11.00,USD,11,USD,Brandlight AI LTD,517057576,,,,,,,,,,,2026-01-09,2026-01-09,,,,,0,OpenAI,SXONGQUGQWWJUTM,#ERROR!,Computer Software Stores,5734,Computer Software Stores,1,5652,Employee - Virtual,SaaS and Subscriptions,SaaS and Subscriptions,"Didi Dvash, Gal Rubin",,6295505,,,Brandlight AI LTD-PayEm-SaaS and Subscriptions-5652,9 Jan 26,01-26,($11),USD,1,($11),Technology,-,($11),Yes,OpenAI,#REF!,G&A,,,9/1/2026
2026-01-09,05:18,CLEARED,NO_SYNC,Bill + Bill payment,$9.45,USD,9.45,USD,Brandlight AI LTD,517057576,,,,,,,,,,,2026-01-09,2026-01-09,,,,,0,OpenAI,SXONGQUGQWWJUTM,#ERROR!,Computer Software Stores,5734,Computer Software Stores,1,5652,Employee - Virtual,SaaS and Subscriptions,SaaS and Subscriptions,"Didi Dvash, Gal Rubin",,6295536,,,Brandlight AI LTD-PayEm-SaaS and Subscriptions-5652,9 Jan 26,01-26,($9),USD,1,($9),Technology,-,($9),Yes,OpenAI,#REF!,R&D,,,9/1/2026
2026-01-09,05:21,CLEARED,NO_SYNC,Bill + Bill payment,$5.50,USD,5.5,USD,Brandlight AI LTD,517057576,,,,,,,,,,,2026-01-09,2026-01-09,,,,,0,OpenAI,SXONGQUGQWWJUTM,#ERROR!,Computer Software Stores,5734,Computer Software Stores,1,5652,Employee - Virtual,SaaS and Subscriptions,SaaS and Subscriptions,"Didi Dvash, Gal Rubin",,6295544,,,Brandlight AI LTD-PayEm-SaaS and Subscriptions-5652,9 Jan 26,01-26,($6),USD,1,($6),Technology,-,($6),Yes,OpenAI,#REF!,R&D,,,9/1/2026
2026-01-09,05:27,CLEARED,NO_SYNC,Bill + Bill payment,$9.98,USD,9.98,USD,Brandlight AI LTD,517057576,,,,,,,,,,,2026-01-09,2026-01-09,,,,,0,OpenAI,SXONGQUGQWWJUTM,#ERROR!,Computer Software Stores,5734,Computer Software Stores,1,5652,Employee - Virtual,SaaS and Subscriptions,SaaS and Subscriptions,"Didi Dvash, Gal Rubin",,6295558,,,Brandlight AI LTD-PayEm-SaaS and Subscriptions-5652,9 Jan 26,01-26,($10),USD,1,($10),Technology,-,($10),Yes,OpenAI,#REF!,G&A,,,9/1/2026
2026-01-09,05:33,CLEARED,NO_SYNC,Bill + Bill payment,$10.13,USD,10.13,USD,Brandlight AI LTD,517057576,,,,,,,,,,,2026-01-09,2026-01-09,,,,,0,OpenAI,SXONGQUGQWWJUTM,#ERROR!,Computer Software Stores,5734,Computer Software Stores,1,5652,Employee - Virtual,SaaS and Subscriptions,SaaS and Subscriptions,"Didi Dvash, Gal Rubin",,6295581,,,Brandlight AI LTD-PayEm-SaaS and Subscriptions-5652,9 Jan 26,01-26,($10),USD,1,($10),Technology,-,($10),Yes,OpenAI,#REF!,G&A,,,9/1/2026
2026-01-09,05:39,CLEARED,NO_SYNC,Bill + Bill payment,$10.72,USD,10.72,USD,Brandlight AI LTD,517057576,,,,,,,,,,,2026-01-09,2026-01-09,,,,,0,OpenAI,SXONGQUGQWWJUTM,#ERROR!,Computer Software Stores,5734,Computer Software Stores,1,5652,Employee - Virtual,SaaS and Subscriptions,SaaS and Subscriptions,"Didi Dvash, Gal Rubin",,6295596,,,Brandlight AI LTD-PayEm-SaaS and Subscriptions-5652,9 Jan 26,01-26,($11),USD,1,($11),Technology,-,($11),Yes,OpenAI,#REF!,G&A,,,9/1/2026
2026-01-09,05:45,CLEARED,NO_SYNC,Bill + Bill payment,$11.03,USD,11.03,USD,Brandlight AI LTD,517057576,,,,,,,,,,,2026-01-09,2026-01-09,,,,,0,OpenAI,SXONGQUGQWWJUTM,#ERROR!,Computer Software Stores,5734,Computer Software Stores,1,5652,Employee - Virtual,SaaS and Subscriptions,SaaS and Subscriptions,"Didi Dvash, Gal Rubin",,6295614,,,Brandlight AI LTD-PayEm-SaaS and Subscriptions-5652,9 Jan 26,01-26,($11),USD,1,($11),Technology,-,($11),Yes,OpenAI,#REF!,G&A,,,9/1/2026
2026-01-09,05:49,CLEARED,NO_SYNC,Bill + Bill payment,$5.85,USD,5.85,USD,Brandlight AI LTD,517057576,,,,,,,,,,,2026-01-09,2026-01-09,,,,,0,OpenAI,SXONGQUGQWWJUTM,#ERROR!,Computer Software Stores,5734,Computer Software Stores,1,5652,Employee - Virtual,SaaS and Subscriptions,SaaS and Subscriptions,"Didi Dvash, Gal Rubin",,6295624,,,Brandlight AI LTD-PayEm-SaaS and Subscriptions-5652,9 Jan 26,01-26,($6),USD,1,($6),Technology,-,($6),Yes,OpenAI,#REF!,G&A,,,9/1/2026
2026-01-09,05:52,CLEARED,NO_SYNC,Bill + Bill payment,$7.19,USD,7.19,USD,Brandlight AI LTD,517057576,,,,,,,,,,,2026-01-09,2026-01-09,,,,,0,OpenAI,SXONGQUGQWWJUTM,#ERROR!,Computer Software Stores,5734,Computer Software Stores,1,5652,Employee - Virtual,SaaS and Subscriptions,SaaS and Subscriptions,"Didi Dvash, Gal Rubin",,6295632,,,Brandlight AI LTD-PayEm-SaaS and Subscriptions-5652,9 Jan 26,01-26,($7),USD,1,($7),Technology,-,($7),Yes,OpenAI,#REF!,S&M,,,9/1/2026
2026-01-09,05:58,CLEARED,NO_SYNC,Bill + Bill payment,$11.45,USD,11.45,USD,Brandlight AI LTD,517057576,,,,,,,,,,,2026-01-09,2026-01-09,,,,,0,OpenAI,SXONGQUGQWWJUTM,#ERROR!,Computer Software Stores,5734,Computer Software Stores,1,5652,Employee - Virtual,SaaS and Subscriptions,SaaS and Subscriptions,"Didi Dvash, Gal Rubin",,6295648,,,Brandlight AI LTD-PayEm-SaaS and Subscriptions-5652,9 Jan 26,01-26,($11),USD,1,($11),Technology,-,($11),Yes,OpenAI,#REF!,G&A,,,9/1/2026
2026-01-09,06:02,CLEARED,NO_SYNC,Bill + Bill payment,$6.99,USD,6.99,USD,Brandlight AI LTD,517057576,,,,,,,,,,,2026-01-09,2026-01-09,,,,,0,OpenAI,SXONGQUGQWWJUTM,#ERROR!,Computer Software Stores,5734,Computer Software Stores,1,5652,Employee - Virtual,SaaS and Subscriptions,SaaS and Subscriptions,"Didi Dvash, Gal Rubin",,6295659,,,Brandlight AI LTD-PayEm-SaaS and Subscriptions-5652,9 Jan 26,01-26,($7),USD,1,($7),Technology,-,($7),Yes,OpenAI,#REF!,G&A,,,9/1/2026
2026-01-09,06:05,CLEARED,NO_SYNC,Bill + Bill payment,$7.64,USD,7.64,USD,Brandlight AI LTD,517057576,,,,,,,,,,,2026-01-09,2026-01-09,,,,,0,OpenAI,SXONGQUGQWWJUTM,#ERROR!,Computer Software Stores,5734,Computer Software Stores,1,5652,Employee - Virtual,SaaS and Subscriptions,SaaS and Subscriptions,"Didi Dvash, Gal Rubin",,6295666,,,Brandlight AI LTD-PayEm-SaaS and Subscriptions-5652,9 Jan 26,01-26,($8),USD,1,($8),Technology,-,($8),Yes,OpenAI,#REF!,G&A,,,9/1/2026
2026-01-09,06:11,DECLINED,NO_SYNC,Bill + Bill payment,$11.17,USD,11.17,USD,Brandlight AI LTD,517057576,,,,,,,,,,,,,,,,,,OpenAI,SXONGQUGQWWJUTM,#ERROR!,Computer Software Stores,5734,Computer Software Stores,1,5652,Employee - Virtual,SaaS and Subscriptions,SaaS and Subscriptions,"Didi Dvash, Gal Rubin",,6295680,,,Brandlight AI LTD-PayEm-SaaS and Subscriptions-5652,9 Jan 26,01-26,($11),USD,1,($11),Technology,-,($11),Yes,OpenAI,#REF!,G&A,,,9/1/2026
2026-01-09,06:11,DECLINED,NO_SYNC,Bill + Bill payment,$11.17,USD,11.17,USD,Brandlight AI LTD,517057576,,,,,,,,,,,,,,,,,,OpenAI,SXONGQUGQWWJUTM,#ERROR!,Computer Software Stores,5734,Computer Software Stores,0,5652,Employee - Virtual,SaaS and Subscriptions,SaaS and Subscriptions,"Didi Dvash, Gal Rubin",,6295681,,,Brandlight AI LTD-PayEm-SaaS and Subscriptions-5652,9 Jan 26,01-26,($11),USD,1,($11),Technology,-,($11),Yes,OpenAI,#REF!,G&A,,,9/1/2026
2026-01-09,08:41,REVERSED,NO_SYNC,Bill + Bill payment,$15.81,USD,50,ILS,Brandlight AI LTD,517057576,,,,,,,,,,,2026-01-09,2026-01-09,,,,,0,GT GET TAXI SYSTEMS LTD,6.04E+06,"TEL AVIV-JAF, ISR, 00000","Transportation Services, Not elsewhere classified)",4789,Transportation Services (Not Elsewhere Classified),0,5483,Employee - Virtual,Hila Haliva,Hila Haliva,,,6296407,,,Brandlight AI LTD-PayEm-Hila Haliva-5483,9 Jan 26,01-26,($16),USD,1,($16),Transportation & Logistics,-,($16),Yes,GT GET TAXI SYSTEMS LTD,#REF!,G&A,,,9/1/2026
2026-01-09,09:01,CLEARED,NO_SYNC,Bill + Bill payment,$8.17,USD,8.17,USD,Brandlight AI LTD,517057576,,,,,,,,,,,2026-01-09,2026-01-09,,,,,0,OpenAI,SXONGQUGQWWJUTM,#ERROR!,Computer Software Stores,5734,Computer Software Stores,1,5652,Employee - Virtual,SaaS and Subscriptions,SaaS and Subscriptions,"Didi Dvash, Gal Rubin",,6296506,,,Brandlight AI LTD-PayEm-SaaS and Subscriptions-5652,9 Jan 26,01-26,($8),USD,1,($8),Technology,-,($8),Yes,OpenAI,#REF!,G&A,,,9/1/2026
2026-01-09,09:04,CLEARED,NO_SYNC,Bill + Bill payment,$7.02,USD,7.02,USD,Brandlight AI LTD,517057576,,,,,,,,,,,2026-01-09,2026-01-09,,,,,0,OpenAI,SXONGQUGQWWJUTM,#ERROR!,Computer Software Stores,5734,Computer Software Stores,1,5652,Employee - Virtual,SaaS and Subscriptions,SaaS and Subscriptions,"Didi Dvash, Gal Rubin",,6296522,,,Brandlight AI LTD-PayEm-SaaS and Subscriptions-5652,9 Jan 26,01-26,($7),USD,1,($7),Technology,-,($7),Yes,OpenAI,#REF!,G&A,,,9/1/2026
2026-01-09,09:10,CLEARED,NO_SYNC,Bill + Bill payment,$11.69,USD,11.69,USD,Brandlight AI LTD,517057576,,,,,,,,,,,2026-01-09,2026-01-09,,,,,0,OpenAI,SXONGQUGQWWJUTM,#ERROR!,Computer Software Stores,5734,Computer Software Stores,1,5652,Employee - Virtual,SaaS and Subscriptions,SaaS and Subscriptions,"Didi Dvash, Gal Rubin",,6296569,,,Brandlight AI LTD-PayEm-SaaS and Subscriptions-5652,9 Jan 26,01-26,($12),USD,1,($12),Technology,-,($12),Yes,OpenAI,#REF!,G&A,,,9/1/2026
2026-01-09,09:16,CLEARED,NO_SYNC,Bill + Bill payment,$57.31,USD,175.94,ILS,Brandlight AI LTD,517057576,,,,,,,,,,,2026-01-09,2026-01-09,,,,,0,GT GET TAXI SYSTEMS LTD,6.04E+06,"TEL AVIV-JAF, ISR, 00000","Transportation Services, Not elsewhere classified)",4789,Transportation Services (Not Elsewhere Classified),0,5483,Employee - Virtual,Hila Haliva,Hila Haliva,,https://app.payemcard.com/api/transactions/6296604/receipt.pdf,6296604,,,Brandlight AI LTD-PayEm-Hila Haliva-5483,9 Jan 26,01-26,($57),USD,1,($57),Transportation & Logistics,-,($57),Yes,GT GET TAXI SYSTEMS LTD,#REF!,G&A,,,9/1/2026
2026-01-09,09:17,CLEARED,NO_SYNC,Bill + Bill payment,$8.38,USD,8.38,USD,Brandlight AI LTD,517057576,,,,,,,,,,,2026-01-09,2026-01-09,,,,,0,OpenAI,SXONGQUGQWWJUTM,#ERROR!,Computer Software Stores,5734,Computer Software Stores,1,5652,Employee - Virtual,SaaS and Subscriptions,SaaS and Subscriptions,"Didi Dvash, Gal Rubin",,6296615,,,Brandlight AI LTD-PayEm-SaaS and Subscriptions-5652,9 Jan 26,01-26,($8),USD,1,($8),Technology,-,($8),Yes,OpenAI,#REF!,G&A,,,9/1/2026
2026-01-09,12:07,CLEARED,NO_SYNC,Bill + Bill payment,$8.44,USD,8.44,USD,Brandlight AI LTD,517057576,,,,,,,,,,,2026-01-09,2026-01-09,,,,,0,OpenAI,SXONGQUGQWWJUTM,#ERROR!,Computer Software Stores,5734,Computer Software Stores,1,5652,Employee - Virtual,SaaS and Subscriptions,SaaS and Subscriptions,"Didi Dvash, Gal Rubin",,6297685,,,Brandlight AI LTD-PayEm-SaaS and Subscriptions-5652,9 Jan 26,01-26,($8),USD,1,($8),Technology,-,($8),Yes,OpenAI,#REF!,G&A,,,9/1/2026
2026-01-09,12:13,CLEARED,NO_SYNC,Bill + Bill payment,$7.30,USD,7.3,USD,Brandlight AI LTD,517057576,,,,,,,,,,,2026-01-09,2026-01-09,,,,,0,OpenAI,SXONGQUGQWWJUTM,#ERROR!,Computer Software Stores,5734,Computer Software Stores,1,5652,Employee - Virtual,SaaS and Subscriptions,SaaS and Subscriptions,"Didi Dvash, Gal Rubin",,6297720,,,Brandlight AI LTD-PayEm-SaaS and Subscriptions-5652,9 Jan 26,01-26,($7),USD,1,($7),Technology,-,($7),Yes,OpenAI,#REF!,S&M,,,9/1/2026
2026-01-09,12:16,CLEARED,NO_SYNC,Bill + Bill payment,$7.08,USD,7.08,USD,Brandlight AI LTD,517057576,,,,,,,,,,,2026-01-09,2026-01-09,,,,,0,OpenAI,SXONGQUGQWWJUTM,#ERROR!,Computer Software Stores,5734,Computer Software Stores,1,5652,Employee - Virtual,SaaS and Subscriptions,SaaS and Subscriptions,"Didi Dvash, Gal Rubin",,6297738,,,Brandlight AI LTD-PayEm-SaaS and Subscriptions-5652,9 Jan 26,01-26,($7),USD,1,($7),Technology,-,($7),Yes,OpenAI,#REF!,G&A,,,9/1/2026
2026-01-09,12:22,CLEARED,NO_SYNC,Bill + Bill payment,$10.37,USD,10.37,USD,Brandlight AI LTD,517057576,,,,,,,,,,,2026-01-09,2026-01-09,,,,,0,OpenAI,SXONGQUGQWWJUTM,#ERROR!,Computer Software Stores,5734,Computer Software Stores,1,5652,Employee - Virtual,SaaS and Subscriptions,SaaS and Subscriptions,"Didi Dvash, Gal Rubin",,6297790,,,Brandlight AI LTD-PayEm-SaaS and Subscriptions-5652,9 Jan 26,01-26,($10),USD,1,($10),Technology,-,($10),Yes,OpenAI,#REF!,G&A,,,9/1/2026
2026-01-09,12:25,CLEARED,NO_SYNC,Bill + Bill payment,$6.08,USD,6.08,USD,Brandlight AI LTD,517057576,,,,,,,,,,,2026-01-09,2026-01-09,,,,,0,OpenAI,SXONGQUGQWWJUTM,#ERROR!,Computer Software Stores,5734,Computer Software Stores,1,5652,Employee - Virtual,SaaS and Subscriptions,SaaS and Subscriptions,"Didi Dvash, Gal Rubin",,6297810,,,Brandlight AI LTD-PayEm-SaaS and Subscriptions-5652,9 Jan 26,01-26,($6),USD,1,($6),Technology,-,($6),Yes,OpenAI,#REF!,R&D,,,9/1/2026
2026-01-09,12:28,CLEARED,NO_SYNC,Bill + Bill payment,$6.36,USD,6.36,USD,Brandlight AI LTD,517057576,,,,,,,,,,,2026-01-09,2026-01-09,,,,,0,OpenAI,SXONGQUGQWWJUTM,#ERROR!,Computer Software Stores,5734,Computer Software Stores,1,5652,Employee - Virtual,SaaS and Subscriptions,SaaS and Subscriptions,"Didi Dvash, Gal Rubin",,6297829,,,Brandlight AI LTD-PayEm-SaaS and Subscriptions-5652,9 Jan 26,01-26,($6),USD,1,($6),Technology,-,($6),Yes,OpenAI,#REF!,R&D,,,9/1/2026
2026-01-09,12:31,CLEARED,NO_SYNC,Bill + Bill payment,$5.85,USD,5.85,USD,Brandlight AI LTD,517057576,,,,,,,,,,,2026-01-09,2026-01-09,,,,,0,OpenAI,SXONGQUGQWWJUTM,#ERROR!,Computer Software Stores,5734,Computer Software Stores,1,5652,Employee - Virtual,SaaS and Subscriptions,SaaS and Subscriptions,"Didi Dvash, Gal Rubin",,6297844,,,Brandlight AI LTD-PayEm-SaaS and Subscriptions-5652,9 Jan 26,01-26,($6),USD,1,($6),Technology,-,($6),Yes,OpenAI,#REF!,G&A,,,9/1/2026
2026-01-09,12:37,CLEARED,NO_SYNC,Bill + Bill payment,$10.85,USD,10.85,USD,Brandlight AI LTD,517057576,,,,,,,,,,,2026-01-09,2026-01-09,,,,,0,OpenAI,SXONGQUGQWWJUTM,#ERROR!,Computer Software Stores,5734,Computer Software Stores,1,5652,Employee - Virtual,SaaS and Subscriptions,SaaS and Subscriptions,"Didi Dvash, Gal Rubin",,6297885,,,Brandlight AI LTD-PayEm-SaaS and Subscriptions-5652,9 Jan 26,01-26,($11),USD,1,($11),Technology,-,($11),Yes,OpenAI,#REF!,G&A,,,9/1/2026
2026-01-09,12:40,CLEARED,NO_SYNC,Bill + Bill payment,$5.57,USD,5.57,USD,Brandlight AI LTD,517057576,,,,,,,,,,,2026-01-09,2026-01-09,,,,,0,OpenAI,SXONGQUGQWWJUTM,#ERROR!,Computer Software Stores,5734,Computer Software Stores,1,5652,Employee - Virtual,SaaS and Subscriptions,SaaS and Subscriptions,"Didi Dvash, Gal Rubin",,6297905,,,Brandlight AI LTD-PayEm-SaaS and Subscriptions-5652,9 Jan 26,01-26,($6),USD,1,($6),Technology,-,($6),Yes,OpenAI,#REF!,G&A,,,9/1/2026
2026-01-09,12:43,CLEARED,NO_SYNC,Bill + Bill payment,$7.46,USD,7.46,USD,Brandlight AI LTD,517057576,,,,,,,,,,,2026-01-09,2026-01-09,,,,,0,OpenAI,SXONGQUGQWWJUTM,#ERROR!,Computer Software Stores,5734,Computer Software Stores,1,5652,Employee - Virtual,SaaS and Subscriptions,SaaS and Subscriptions,"Didi Dvash, Gal Rubin",,6297929,,,Brandlight AI LTD-PayEm-SaaS and Subscriptions-5652,9 Jan 26,01-26,($7),USD,1,($7),Technology,-,($7),Yes,OpenAI,#REF!,G&A,,,9/1/2026
2026-01-09,12:46,CLEARED,NO_SYNC,Bill + Bill payment,$5.96,USD,5.96,USD,Brandlight AI LTD,517057576,,,,,,,,,,,2026-01-09,2026-01-09,,,,,0,OpenAI,SXONGQUGQWWJUTM,#ERROR!,Computer Software Stores,5734,Computer Software Stores,1,5652,Employee - Virtual,SaaS and Subscriptions,SaaS and Subscriptions,"Didi Dvash, Gal Rubin",,6297954,,,Brandlight AI LTD-PayEm-SaaS and Subscriptions-5652,9 Jan 26,01-26,($6),USD,1,($6),Technology,-,($6),Yes,OpenAI,#REF!,S&M,,,9/1/2026
2026-01-09,12:52,CLEARED,NO_SYNC,Bill + Bill payment,$5.41,USD,5.41,USD,Brandlight AI LTD,517057576,,,,,,,,,,,2026-01-09,2026-01-09,,,,,0,OpenAI,SXONGQUGQWWJUTM,#ERROR!,Computer Software Stores,5734,Computer Software Stores,1,5652,Employee - Virtual,SaaS and Subscriptions,SaaS and Subscriptions,"Didi Dvash, Gal Rubin",,6297991,,,Brandlight AI LTD-PayEm-SaaS and Subscriptions-5652,9 Jan 26,01-26,($5),USD,1,($5),Technology,-,($5),Yes,OpenAI,#REF!,G&A,,,9/1/2026
2026-01-09,13:48,CLEARED,NO_SYNC,Bill + Bill payment,$7.65,USD,7.65,USD,Brandlight AI LTD,517057576,,,,,,,,,,,2026-01-09,2026-01-09,,,,,0,OpenAI,SXONGQUGQWWJUTM,#ERROR!,Computer Software Stores,5734,Computer Software Stores,1,5652,Employee - Virtual,SaaS and Subscriptions,SaaS and Subscriptions,"Didi Dvash, Gal Rubin",,6298341,,,Brandlight AI LTD-PayEm-SaaS and Subscriptions-5652,9 Jan 26,01-26,($8),USD,1,($8),Technology,-,($8),Yes,OpenAI,#REF!,G&A,,,9/1/2026
2026-01-09,13:54,CLEARED,NO_SYNC,Bill + Bill payment,$8.17,USD,8.17,USD,Brandlight AI LTD,517057576,,,,,,,,,,,2026-01-09,2026-01-09,,,,,0,OpenAI,SXONGQUGQWWJUTM,#ERROR!,Computer Software Stores,5734,Computer Software Stores,1,5652,Employee - Virtual,SaaS and Subscriptions,SaaS and Subscriptions,"Didi Dvash, Gal Rubin",,6298386,,,Brandlight AI LTD-PayEm-SaaS and Subscriptions-5652,9 Jan 26,01-26,($8),USD,1,($8),Technology,-,($8),Yes,OpenAI,#REF!,G&A,,,9/1/2026
2026-01-09,13:57,CLEARED,NO_SYNC,Bill + Bill payment,$6.98,USD,6.98,USD,Brandlight AI LTD,517057576,,,,,,,,,,,2026-01-09,2026-01-09,,,,,0,OpenAI,SXONGQUGQWWJUTM,#ERROR!,Computer Software Stores,5734,Computer Software Stores,1,5652,Employee - Virtual,SaaS and Subscriptions,SaaS and Subscriptions,"Didi Dvash, Gal Rubin",,6298409,,,Brandlight AI LTD-PayEm-SaaS and Subscriptions-5652,9 Jan 26,01-26,($7),USD,1,($7),Technology,-,($7),Yes,OpenAI,#REF!,G&A,,,9/1/2026
2026-01-09,14:03,CLEARED,NO_SYNC,Bill + Bill payment,$12.12,USD,12.12,USD,Brandlight AI LTD,517057576,,,,,,,,,,,2026-01-09,2026-01-09,,,,,0,OpenAI,SXONGQUGQWWJUTM,#ERROR!,Computer Software Stores,5734,Computer Software Stores,1,5652,Employee - Virtual,SaaS and Subscriptions,SaaS and Subscriptions,"Didi Dvash, Gal Rubin",,6298465,,,Brandlight AI LTD-PayEm-SaaS and Subscriptions-5652,9 Jan 26,01-26,($12),USD,1,($12),Technology,-,($12),Yes,OpenAI,#REF!,G&A,,,9/1/2026
2026-01-09,14:06,CLEARED,NO_SYNC,Bill + Bill payment,$204.21,USD,204.21,USD,Brandlight AI LTD,517057576,,,,,,,,,,,2026-01-09,2026-01-09,,,,,0,CURSOR USAGE  DEC,MZJ96QO0A3SN4BD,#ERROR!,Computer Software Stores,5734,Computer Software Stores,1,5652,Employee - Virtual,SaaS and Subscriptions,SaaS and Subscriptions,"Didi Dvash, Gal Rubin",https://app.payemcard.com/api/transactions/6298490/receipt.pdf,6298490,,,Brandlight AI LTD-PayEm-SaaS and Subscriptions-5652,9 Jan 26,01-26,($204),USD,1,($204),#N/A,-,($204),#N/A,CURSOR USAGE  DEC,#REF!,S&M,#N/A,#N/A,9/1/2026
2026-01-09,14:07,CLEARED,NO_SYNC,Bill + Bill payment,$6.68,USD,6.68,USD,Brandlight AI LTD,517057576,,,,,,,,,,,2026-01-09,2026-01-09,,,,,0,OpenAI,SXONGQUGQWWJUTM,#ERROR!,Computer Software Stores,5734,Computer Software Stores,1,5652,Employee - Virtual,SaaS and Subscriptions,SaaS and Subscriptions,"Didi Dvash, Gal Rubin",,6298496,,,Brandlight AI LTD-PayEm-SaaS and Subscriptions-5652,9 Jan 26,01-26,($7),USD,1,($7),Technology,-,($7),Yes,OpenAI,#REF!,G&A,,,9/1/2026
2026-01-09,14:10,CLEARED,NO_SYNC,Bill + Bill payment,$9.59,USD,9.59,USD,Brandlight AI LTD,517057576,,,,,,,,,,,2026-01-09,2026-01-09,,,,,0,OpenAI,SXONGQUGQWWJUTM,#ERROR!,Computer Software Stores,5734,Computer Software Stores,1,5652,Employee - Virtual,SaaS and Subscriptions,SaaS and Subscriptions,"Didi Dvash, Gal Rubin",,6298527,,,Brandlight AI LTD-PayEm-SaaS and Subscriptions-5652,9 Jan 26,01-26,($10),USD,1,($10),Technology,-,($10),Yes,OpenAI,#REF!,G&A,,,9/1/2026
2026-01-09,14:13,CLEARED,NO_SYNC,Bill + Bill payment,$7.13,USD,7.13,USD,Brandlight AI LTD,517057576,,,,,,,,,,,2026-01-09,2026-01-09,,,,,0,OpenAI,SXONGQUGQWWJUTM,#ERROR!,Computer Software Stores,5734,Computer Software Stores,1,5652,Employee - Virtual,SaaS and Subscriptions,SaaS and Subscriptions,"Didi Dvash, Gal Rubin",,6298550,,,Brandlight AI LTD-PayEm-SaaS and Subscriptions-5652,9 Jan 26,01-26,($7),USD,1,($7),Technology,-,($7),Yes,OpenAI,#REF!,G&A,,,9/1/2026
2026-01-09,14:16,CLEARED,NO_SYNC,Bill + Bill payment,$9.90,USD,9.9,USD,Brandlight AI LTD,517057576,,,,,,,,,,,2026-01-09,2026-01-09,,,,,0,OpenAI,SXONGQUGQWWJUTM,#ERROR!,Computer Software Stores,5734,Computer Software Stores,1,5652,Employee - Virtual,SaaS and Subscriptions,SaaS and Subscriptions,"Didi Dvash, Gal Rubin",,6298571,,,Brandlight AI LTD-PayEm-SaaS and Subscriptions-5652,9 Jan 26,01-26,($10),USD,1,($10),Technology,-,($10),Yes,OpenAI,#REF!,G&A,,,9/1/2026
2026-01-09,19:32,CLEARED,NO_SYNC,Bill + Bill payment,$12.02,USD,12.02,USD,Brandlight AI LTD,517057576,,,,,,,,,,,2026-01-09,2026-01-09,,,,,0,OpenAI,SXONGQUGQWWJUTM,#ERROR!,Computer Software Stores,5734,Computer Software Stores,1,5652,Employee - Virtual,SaaS and Subscriptions,SaaS and Subscriptions,"Didi Dvash, Gal Rubin",,6300633,,,Brandlight AI LTD-PayEm-SaaS and Subscriptions-5652,9 Jan 26,01-26,($12),USD,1,($12),Technology,-,($12),Yes,OpenAI,#REF!,G&A,,,9/1/2026
2026-01-09,19:35,CLEARED,NO_SYNC,Bill + Bill payment,$6.05,USD,6.05,USD,Brandlight AI LTD,517057576,,,,,,,,,,,2026-01-09,2026-01-09,,,,,0,OpenAI,SXONGQUGQWWJUTM,#ERROR!,Computer Software Stores,5734,Computer Software Stores,1,5652,Employee - Virtual,SaaS and Subscriptions,SaaS and Subscriptions,"Didi Dvash, Gal Rubin",,6300648,,,Brandlight AI LTD-PayEm-SaaS and Subscriptions-5652,9 Jan 26,01-26,($6),USD,1,($6),Technology,-,($6),Yes,OpenAI,#REF!,G&A,,,9/1/2026
2026-01-09,19:38,CLEARED,NO_SYNC,Bill + Bill payment,$9.09,USD,9.09,USD,Brandlight AI LTD,517057576,,,,,,,,,,,2026-01-09,2026-01-09,,,,,0,OpenAI,SXONGQUGQWWJUTM,#ERROR!,Computer Software Stores,5734,Computer Software Stores,1,5652,Employee - Virtual,SaaS and Subscriptions,SaaS and Subscriptions,"Didi Dvash, Gal Rubin",,6300661,,,Brandlight AI LTD-PayEm-SaaS and Subscriptions-5652,9 Jan 26,01-26,($9),USD,1,($9),Technology,-,($9),Yes,OpenAI,#REF!,G&A,,,9/1/2026
2026-01-09,19:42,CLEARED,NO_SYNC,Bill + Bill payment,$9.11,USD,9.11,USD,Brandlight AI LTD,517057576,,,,,,,,,,,2026-01-09,2026-01-09,,,,,0,OpenAI,SXONGQUGQWWJUTM,#ERROR!,Computer Software Stores,5734,Computer Software Stores,1,5652,Employee - Virtual,SaaS and Subscriptions,SaaS and Subscriptions,"Didi Dvash, Gal Rubin",,6300685,,,Brandlight AI LTD-PayEm-SaaS and Subscriptions-5652,9 Jan 26,01-26,($9),USD,1,($9),Technology,-,($9),Yes,OpenAI,#REF!,G&A,,,9/1/2026
2026-01-09,19:45,CLEARED,NO_SYNC,Bill + Bill payment,$5.70,USD,5.7,USD,Brandlight AI LTD,517057576,,,,,,,,,,,2026-01-09,2026-01-09,,,,,0,OpenAI,SXONGQUGQWWJUTM,#ERROR!,Computer Software Stores,5734,Computer Software Stores,1,5652,Employee - Virtual,SaaS and Subscriptions,SaaS and Subscriptions,"Didi Dvash, Gal Rubin",,6300702,,,Brandlight AI LTD-PayEm-SaaS and Subscriptions-5652,9 Jan 26,01-26,($6),USD,1,($6),Technology,-,($6),Yes,OpenAI,#REF!,G&A,,,9/1/2026
2026-01-09,19:51,CLEARED,NO_SYNC,Bill + Bill payment,$8.31,USD,8.31,USD,Brandlight AI LTD,517057576,,,,,,,,,,,2026-01-09,2026-01-09,,,,,0,OpenAI,SXONGQUGQWWJUTM,#ERROR!,Computer Software Stores,5734,Computer Software Stores,1,5652,Employee - Virtual,SaaS and Subscriptions,SaaS and Subscriptions,"Didi Dvash, Gal Rubin",,6300739,,,Brandlight AI LTD-PayEm-SaaS and Subscriptions-5652,9 Jan 26,01-26,($8),USD,1,($8),Technology,-,($8),Yes,OpenAI,#REF!,G&A,,,9/1/2026
2026-01-09,20:58,CLEARED,NO_SYNC,Bill + Bill payment,$7.18,USD,7.18,USD,Brandlight AI LTD,517057576,,,,,,,,,,,2026-01-09,2026-01-09,,,,,0,OpenAI,SXONGQUGQWWJUTM,#ERROR!,Computer Software Stores,5734,Computer Software Stores,1,5652,Employee - Virtual,SaaS and Subscriptions,SaaS and Subscriptions,"Didi Dvash, Gal Rubin",,6301058,,,Brandlight AI LTD-PayEm-SaaS and Subscriptions-5652,9 Jan 26,01-26,($7),USD,1,($7),Technology,-,($7),Yes,OpenAI,#REF!,G&A,,,9/1/2026
2026-01-09,21:01,CLEARED,NO_SYNC,Bill + Bill payment,$5.84,USD,5.84,USD,Brandlight AI LTD,517057576,,,,,,,,,,,2026-01-09,2026-01-09,,,,,0,OpenAI,SXONGQUGQWWJUTM,#ERROR!,Computer Software Stores,5734,Computer Software Stores,1,5652,Employee - Virtual,SaaS and Subscriptions,SaaS and Subscriptions,"Didi Dvash, Gal Rubin",,6301075,,,Brandlight AI LTD-PayEm-SaaS and Subscriptions-5652,9 Jan 26,01-26,($6),USD,1,($6),Technology,-,($6),Yes,OpenAI,#REF!,G&A,,,9/1/2026
2026-01-09,21:07,CLEARED,NO_SYNC,Bill + Bill payment,$8.86,USD,8.86,USD,Brandlight AI LTD,517057576,,,,,,,,,,,2026-01-09,2026-01-09,,,,,0,OpenAI,SXONGQUGQWWJUTM,#ERROR!,Computer Software Stores,5734,Computer Software Stores,1,5652,Employee - Virtual,SaaS and Subscriptions,SaaS and Subscriptions,"Didi Dvash, Gal Rubin",,6301111,,,Brandlight AI LTD-PayEm-SaaS and Subscriptions-5652,9 Jan 26,01-26,($9),USD,1,($9),Technology,-,($9),Yes,OpenAI,#REF!,G&A,,,9/1/2026
2026-01-09,21:12,CLEARED,NO_SYNC,Bill + Bill payment,$8.89,USD,8.89,USD,Brandlight AI LTD,517057576,,,,,,,,,,,2026-01-09,2026-01-09,,,,,0,OpenAI,SXONGQUGQWWJUTM,#ERROR!,Computer Software Stores,5734,Computer Software Stores,1,5652,Employee - Virtual,SaaS and Subscriptions,SaaS and Subscriptions,"Didi Dvash, Gal Rubin",,6301130,,,Brandlight AI LTD-PayEm-SaaS and Subscriptions-5652,9 Jan 26,01-26,($9),USD,1,($9),Technology,-,($9),Yes,OpenAI,#REF!,G&A,,,9/1/2026
2026-01-09,21:15,CLEARED,NO_SYNC,Bill + Bill payment,$6.44,USD,6.44,USD,Brandlight AI LTD,517057576,,,,,,,,,,,2026-01-09,2026-01-09,,,,,0,OpenAI,SXONGQUGQWWJUTM,#ERROR!,Computer Software Stores,5734,Computer Software Stores,1,5652,Employee - Virtual,SaaS and Subscriptions,SaaS and Subscriptions,"Didi Dvash, Gal Rubin",,6301142,,,Brandlight AI LTD-PayEm-SaaS and Subscriptions-5652,9 Jan 26,01-26,($6),USD,1,($6),Technology,-,($6),Yes,OpenAI,#REF!,G&A,,,9/1/2026
2026-01-09,21:21,CLEARED,NO_SYNC,Bill + Bill payment,$6.00,USD,6,USD,Brandlight AI LTD,517057576,,,,,,,,,,,2026-01-09,2026-01-09,,,,,0,OpenAI,SXONGQUGQWWJUTM,#ERROR!,Computer Software Stores,5734,Computer Software Stores,1,5652,Employee - Virtual,SaaS and Subscriptions,SaaS and Subscriptions,"Didi Dvash, Gal Rubin",,6301190,,,Brandlight AI LTD-PayEm-SaaS and Subscriptions-5652,9 Jan 26,01-26,($6),USD,1,($6),Technology,-,($6),Yes,OpenAI,#REF!,G&A,,,9/1/2026
2026-01-10,01:26,CLEARED,NO_SYNC,Bill + Bill payment,"$1,000.00",USD,1000,USD,Brandlight AI LTD,517057576,,,,,,,,,,,2026-01-10,2026-01-10,,,,,0,BRIGHTDATA,9.12E+11,"412-5966371, USA, 10018",Computer Software Stores,5734,Computer Software Stores,1,5652,Employee - Virtual,SaaS and Subscriptions,SaaS and Subscriptions,"Didi Dvash, Gal Rubin",,6302178,,,Brandlight AI LTD-PayEm-SaaS and Subscriptions-5652,10 Jan 26,01-26,"($1,000)",USD,1,"($1,000)",Technology,-,"($1,000)",Yes,BRIGHTDATA,#REF!,R&D,,,10/1/2026
2026-01-10,02:15,CLEARED,NO_SYNC,Bill + Bill payment,$28.83,USD,24,EUR,Brandlight AI LTD,517057576,,,,,,,,,,,2026-01-10,2026-01-10,,,,,0,PADDLE.NET* N8N CLOUD1,2.08E+05,"London, GBR, 00000",Digital Goods – Applications (Excludes Games),5817,,1,5652,Employee - Virtual,SaaS and Subscriptions,SaaS and Subscriptions,"Didi Dvash, Gal Rubin",,6302325,,,Brandlight AI LTD-PayEm-SaaS and Subscriptions-5652,10 Jan 26,01-26,($29),USD,1,($29),Tools,-,($29),Yes,PADDLE.NET* N8N CLOUD1,#REF!,G&A,,,10/1/2026
2026-01-10,03:50,CLEARED,NO_SYNC,Bill + Bill payment,$454.43,USD,454.43,USD,Brandlight AI LTD,517057576,,,,,,,,,,,2026-01-10,2026-01-10,,,,,0,ANTHROPIC,Q0RRUWQV26H30SO,#ERROR!,Computer Software Stores,5734,Computer Software Stores,0,5652,Employee - Virtual,SaaS and Subscriptions,SaaS and Subscriptions,"Didi Dvash, Gal Rubin",,6302634,,,Brandlight AI LTD-PayEm-SaaS and Subscriptions-5652,10 Jan 26,01-26,($454),USD,1,($454),Technology,-,($454),Yes,ANTHROPIC,#REF!,G&A,,,10/1/2026
2026-01-10,07:23,CLEARED,NO_SYNC,Bill + Bill payment,$456.19,USD,456.19,USD,Brandlight AI LTD,517057576,,,,,,,,,,,2026-01-10,2026-01-10,,,,,0,ANTHROPIC,Q0RRUWQV26H30SO,#ERROR!,Computer Software Stores,5734,Computer Software Stores,0,5652,Employee - Virtual,SaaS and Subscriptions,SaaS and Subscriptions,"Didi Dvash, Gal Rubin",,6303478,,,Brandlight AI LTD-PayEm-SaaS and Subscriptions-5652,10 Jan 26,01-26,($456),USD,1,($456),Technology,-,($456),Yes,ANTHROPIC,#REF!,S&M,,,10/1/2026
2026-01-10,08:11,CLEARED,NO_SYNC,Bill + Bill payment,$11.49,USD,11.49,USD,Brandlight AI LTD,517057576,,,,,,,,,,,2026-01-10,2026-01-10,,,,,0,WWW.PERPLEXITY.AI,GWLETHIMMO07FWD,#ERROR!,"Digital Goods Media – Books, Movies, Music",5815,,1,5652,Employee - Virtual,SaaS and Subscriptions,SaaS and Subscriptions,"Didi Dvash, Gal Rubin",,6303699,,,Brandlight AI LTD-PayEm-SaaS and Subscriptions-5652,10 Jan 26,01-26,($11),USD,1,($11),Tools,-,($11),Yes,WWW.PERPLEXITY.AI,#REF!,G&A,,,10/1/2026
2026-01-10,10:06,CLEARED,NO_SYNC,Bill + Bill payment,"$1,000.00",USD,1000,USD,Brandlight AI LTD,517057576,,,,,,,,,,,2026-01-10,2026-01-10,,,,,0,BRIGHTDATA,9.12E+11,"412-5966371, USA, 10018",Computer Software Stores,5734,Computer Software Stores,1,5652,Employee - Virtual,SaaS and Subscriptions,SaaS and Subscriptions,"Didi Dvash, Gal Rubin",,6304176,,,Brandlight AI LTD-PayEm-SaaS and Subscriptions-5652,10 Jan 26,01-26,"($1,000)",USD,1,"($1,000)",Technology,-,"($1,000)",Yes,BRIGHTDATA,#REF!,G&A,,,10/1/2026
2026-01-10,15:06,CLEARED,NO_SYNC,Bill + Bill payment,$6.97,USD,6.97,USD,Brandlight AI LTD,517057576,,,,,,,,,,,2026-01-10,2026-01-10,,,,,0,OpenAI,SXONGQUGQWWJUTM,#ERROR!,Computer Software Stores,5734,Computer Software Stores,1,5652,Employee - Virtual,SaaS and Subscriptions,SaaS and Subscriptions,"Didi Dvash, Gal Rubin",,6305692,,,Brandlight AI LTD-PayEm-SaaS and Subscriptions-5652,10 Jan 26,01-26,($7),USD,1,($7),Technology,-,($7),Yes,OpenAI,#REF!,G&A,,,10/1/2026
2026-01-10,15:12,CLEARED,NO_SYNC,Bill + Bill payment,$6.95,USD,6.95,USD,Brandlight AI LTD,517057576,,,,,,,,,,,2026-01-10,2026-01-10,,,,,0,OpenAI,SXONGQUGQWWJUTM,#ERROR!,Computer Software Stores,5734,Computer Software Stores,1,5652,Employee - Virtual,SaaS and Subscriptions,SaaS and Subscriptions,"Didi Dvash, Gal Rubin",,6305737,,,Brandlight AI LTD-PayEm-SaaS and Subscriptions-5652,10 Jan 26,01-26,($7),USD,1,($7),Technology,-,($7),Yes,OpenAI,#REF!,S&M,,,10/1/2026
2026-01-10,15:15,CLEARED,NO_SYNC,Bill + Bill payment,$7.86,USD,7.86,USD,Brandlight AI LTD,517057576,,,,,,,,,,,2026-01-10,2026-01-10,,,,,0,OpenAI,SXONGQUGQWWJUTM,#ERROR!,Computer Software Stores,5734,Computer Software Stores,1,5652,Employee - Virtual,SaaS and Subscriptions,SaaS and Subscriptions,"Didi Dvash, Gal Rubin",,6305759,,,Brandlight AI LTD-PayEm-SaaS and Subscriptions-5652,10 Jan 26,01-26,($8),USD,1,($8),Technology,-,($8),Yes,OpenAI,#REF!,G&A,,,10/1/2026
2026-01-10,15:22,CLEARED,NO_SYNC,Bill + Bill payment,$7.96,USD,7.96,USD,Brandlight AI LTD,517057576,,,,,,,,,,,2026-01-10,2026-01-10,,,,,0,OpenAI,SXONGQUGQWWJUTM,#ERROR!,Computer Software Stores,5734,Computer Software Stores,1,5652,Employee - Virtual,SaaS and Subscriptions,SaaS and Subscriptions,"Didi Dvash, Gal Rubin",,6305785,,,Brandlight AI LTD-PayEm-SaaS and Subscriptions-5652,10 Jan 26,01-26,($8),USD,1,($8),Technology,-,($8),Yes,OpenAI,#REF!,G&A,,,10/1/2026
2026-01-10,15:48,CLEARED,NO_SYNC,Bill + Bill payment,$9.95,USD,9.95,USD,Brandlight AI LTD,517057576,,,,,,,,,,,2026-01-10,2026-01-10,,,,,0,OpenAI,SXONGQUGQWWJUTM,#ERROR!,Computer Software Stores,5734,Computer Software Stores,1,5652,Employee - Virtual,SaaS and Subscriptions,SaaS and Subscriptions,"Didi Dvash, Gal Rubin",,6305952,,,Brandlight AI LTD-PayEm-SaaS and Subscriptions-5652,10 Jan 26,01-26,($10),USD,1,($10),Technology,-,($10),Yes,OpenAI,#REF!,G&A,,,10/1/2026
2026-01-10,15:55,CLEARED,NO_SYNC,Bill + Bill payment,$10.28,USD,10.28,USD,Brandlight AI LTD,517057576,,,,,,,,,,,2026-01-10,2026-01-10,,,,,0,OpenAI,SXONGQUGQWWJUTM,#ERROR!,Computer Software Stores,5734,Computer Software Stores,1,5652,Employee - Virtual,SaaS and Subscriptions,SaaS and Subscriptions,"Didi Dvash, Gal Rubin",,6306003,,,Brandlight AI LTD-PayEm-SaaS and Subscriptions-5652,10 Jan 26,01-26,($10),USD,1,($10),Technology,-,($10),Yes,OpenAI,#REF!,G&A,,,10/1/2026
2026-01-10,16:01,CLEARED,NO_SYNC,Bill + Bill payment,$6.12,USD,6.12,USD,Brandlight AI LTD,517057576,,,,,,,,,,,2026-01-10,2026-01-10,,,,,0,OpenAI,SXONGQUGQWWJUTM,#ERROR!,Computer Software Stores,5734,Computer Software Stores,1,5652,Employee - Virtual,SaaS and Subscriptions,SaaS and Subscriptions,"Didi Dvash, Gal Rubin",,6306032,,,Brandlight AI LTD-PayEm-SaaS and Subscriptions-5652,10 Jan 26,01-26,($6),USD,1,($6),Technology,-,($6),Yes,OpenAI,#REF!,G&A,,,10/1/2026
2026-01-10,16:21,REVERSED,NO_SYNC,Bill + Bill payment,$60.09,USD,188.9,ILS,Brandlight AI LTD,517057576,,,,,,,,,,,2026-01-10,2026-01-10,,,,,0,Wolt,8763879,"TEL AVIV, ISR, 65817",Eating places and Restaurants,5812,"Eating Places, Restaurants",0,5483,Employee - Virtual,Hila Haliva,Hila Haliva,,,6306122,,,Brandlight AI LTD-PayEm-Hila Haliva-5483,10 Jan 26,01-26,($60),USD,1,($60),Refreshments & Welfare,-,($60),Yes,Wolt,#REF!,S&M,,,10/1/2026
2026-01-10,17:37,CLEARED,NO_SYNC,Bill + Bill payment,$53.70,USD,163.9,ILS,Brandlight AI LTD,517057576,,,,,,,,,,,2026-01-10,2026-01-10,,,,,0,Wolt,8763879,"TEL AVIV, ISR, 65817",Eating places and Restaurants,5812,"Eating Places, Restaurants",0,3635,Employee - Virtual,Gal Rubin,Gal Rubin,Gal Rubin,https://app.payemcard.com/api/transactions/6306471/receipt.pdf,6306471,,,Brandlight AI LTD-PayEm-Gal Rubin-3635,10 Jan 26,01-26,($54),USD,1,($54),Refreshments & Welfare,-,($54),Yes,Wolt,#REF!,R&D,,,10/1/2026
2026-01-10,18:15,CLEARED,NO_SYNC,Bill + Bill payment,$5.87,USD,5.87,USD,Brandlight AI LTD,517057576,,,,,,,,,,,2026-01-10,2026-01-10,,,,,0,OpenAI,SXONGQUGQWWJUTM,#ERROR!,Computer Software Stores,5734,Computer Software Stores,1,5652,Employee - Virtual,SaaS and Subscriptions,SaaS and Subscriptions,"Didi Dvash, Gal Rubin",,6306640,,,Brandlight AI LTD-PayEm-SaaS and Subscriptions-5652,10 Jan 26,01-26,($6),USD,1,($6),Technology,-,($6),Yes,OpenAI,#REF!,G&A,,,10/1/2026
2026-01-10,18:18,CLEARED,NO_SYNC,Bill + Bill payment,$5.05,USD,5.05,USD,Brandlight AI LTD,517057576,,,,,,,,,,,2026-01-10,2026-01-10,,,,,0,OpenAI,SXONGQUGQWWJUTM,#ERROR!,Computer Software Stores,5734,Computer Software Stores,1,5652,Employee - Virtual,SaaS and Subscriptions,SaaS and Subscriptions,"Didi Dvash, Gal Rubin",,6306655,,,Brandlight AI LTD-PayEm-SaaS and Subscriptions-5652,10 Jan 26,01-26,($5),USD,1,($5),Technology,-,($5),Yes,OpenAI,#REF!,G&A,,,10/1/2026
2026-01-10,18:22,CLEARED,NO_SYNC,Bill + Bill payment,$6.74,USD,6.74,USD,Brandlight AI LTD,517057576,,,,,,,,,,,2026-01-10,2026-01-10,,,,,0,OpenAI,SXONGQUGQWWJUTM,#ERROR!,Computer Software Stores,5734,Computer Software Stores,1,5652,Employee - Virtual,SaaS and Subscriptions,SaaS and Subscriptions,"Didi Dvash, Gal Rubin",,6306682,,,Brandlight AI LTD-PayEm-SaaS and Subscriptions-5652,10 Jan 26,01-26,($7),USD,1,($7),Technology,-,($7),Yes,OpenAI,#REF!,G&A,,,10/1/2026
2026-01-10,18:28,CLEARED,NO_SYNC,Bill + Bill payment,$5.79,USD,5.79,USD,Brandlight AI LTD,517057576,,,,,,,,,,,2026-01-10,2026-01-10,,,,,0,OpenAI,SXONGQUGQWWJUTM,#ERROR!,Computer Software Stores,5734,Computer Software Stores,1,5652,Employee - Virtual,SaaS and Subscriptions,SaaS and Subscriptions,"Didi Dvash, Gal Rubin",,6306708,,,Brandlight AI LTD-PayEm-SaaS and Subscriptions-5652,10 Jan 26,01-26,($6),USD,1,($6),Technology,-,($6),Yes,OpenAI,#REF!,G&A,,,10/1/2026
2026-01-10,19:35,CLEARED,NO_SYNC,Bill + Bill payment,$6.62,USD,6.62,USD,Brandlight AI LTD,517057576,,,,,,,,,,,2026-01-10,2026-01-10,,,,,0,OpenAI,SXONGQUGQWWJUTM,#ERROR!,Computer Software Stores,5734,Computer Software Stores,1,5652,Employee - Virtual,SaaS and Subscriptions,SaaS and Subscriptions,"Didi Dvash, Gal Rubin",,6307019,,,Brandlight AI LTD-PayEm-SaaS and Subscriptions-5652,10 Jan 26,01-26,($7),USD,1,($7),Technology,-,($7),Yes,OpenAI,#REF!,G&A,,,10/1/2026
2026-01-10,19:38,CLEARED,NO_SYNC,Bill + Bill payment,$5.23,USD,5.23,USD,Brandlight AI LTD,517057576,,,,,,,,,,,2026-01-10,2026-01-10,,,,,0,OpenAI,SXONGQUGQWWJUTM,#ERROR!,Computer Software Stores,5734,Computer Software Stores,1,5652,Employee - Virtual,SaaS and Subscriptions,SaaS and Subscriptions,"Didi Dvash, Gal Rubin",,6307035,,,Brandlight AI LTD-PayEm-SaaS and Subscriptions-5652,10 Jan 26,01-26,($5),USD,1,($5),Technology,-,($5),Yes,OpenAI,#REF!,G&A,,,10/1/2026
2026-01-10,19:41,CLEARED,NO_SYNC,Bill + Bill payment,$5.72,USD,5.72,USD,Brandlight AI LTD,517057576,,,,,,,,,,,2026-01-10,2026-01-10,,,,,0,OpenAI,SXONGQUGQWWJUTM,#ERROR!,Computer Software Stores,5734,Computer Software Stores,1,5652,Employee - Virtual,SaaS and Subscriptions,SaaS and Subscriptions,"Didi Dvash, Gal Rubin",,6307045,,,Brandlight AI LTD-PayEm-SaaS and Subscriptions-5652,10 Jan 26,01-26,($6),USD,1,($6),Technology,-,($6),Yes,OpenAI,#REF!,G&A,,,10/1/2026
2026-01-10,20:27,CLEARED,NO_SYNC,Bill + Bill payment,$6.91,USD,6.91,USD,Brandlight AI LTD,517057576,,,,,,,,,,,2026-01-10,2026-01-10,,,,,0,OpenAI,SXONGQUGQWWJUTM,#ERROR!,Computer Software Stores,5734,Computer Software Stores,1,5652,Employee - Virtual,SaaS and Subscriptions,SaaS and Subscriptions,"Didi Dvash, Gal Rubin",,6307239,,,Brandlight AI LTD-PayEm-SaaS and Subscriptions-5652,10 Jan 26,01-26,($7),USD,1,($7),Technology,-,($7),Yes,OpenAI,#REF!,G&A,,,10/1/2026
2026-01-10,20:34,CLEARED,NO_SYNC,Bill + Bill payment,$11.96,USD,11.96,USD,Brandlight AI LTD,517057576,,,,,,,,,,,2026-01-10,2026-01-10,,,,,0,OpenAI,SXONGQUGQWWJUTM,#ERROR!,Computer Software Stores,5734,Computer Software Stores,1,5652,Employee - Virtual,SaaS and Subscriptions,SaaS and Subscriptions,"Didi Dvash, Gal Rubin",,6307265,,,Brandlight AI LTD-PayEm-SaaS and Subscriptions-5652,10 Jan 26,01-26,($12),USD,1,($12),Technology,-,($12),Yes,OpenAI,#REF!,G&A,,,10/1/2026
2026-01-10,20:58,CLEARED,NO_SYNC,Bill + Bill payment,$6.49,USD,6.49,USD,Brandlight AI LTD,517057576,,,,,,,,,,,2026-01-10,2026-01-10,,,,,0,OpenAI,SXONGQUGQWWJUTM,#ERROR!,Computer Software Stores,5734,Computer Software Stores,1,5652,Employee - Virtual,SaaS and Subscriptions,SaaS and Subscriptions,"Didi Dvash, Gal Rubin",,6307349,,,Brandlight AI LTD-PayEm-SaaS and Subscriptions-5652,10 Jan 26,01-26,($6),USD,1,($6),Technology,-,($6),Yes,OpenAI,#REF!,G&A,,,10/1/2026
2026-01-10,21:01,CLEARED,NO_SYNC,Bill + Bill payment,$5.85,USD,5.85,USD,Brandlight AI LTD,517057576,,,,,,,,,,,2026-01-10,2026-01-10,,,,,0,OpenAI,SXONGQUGQWWJUTM,#ERROR!,Computer Software Stores,5734,Computer Software Stores,1,5652,Employee - Virtual,SaaS and Subscriptions,SaaS and Subscriptions,"Didi Dvash, Gal Rubin",,6307355,,,Brandlight AI LTD-PayEm-SaaS and Subscriptions-5652,10 Jan 26,01-26,($6),USD,1,($6),Technology,-,($6),Yes,OpenAI,#REF!,R&D,,,10/1/2026
2026-01-10,21:07,CLEARED,NO_SYNC,Bill + Bill payment,$8.55,USD,8.55,USD,Brandlight AI LTD,517057576,,,,,,,,,,,2026-01-10,2026-01-10,,,,,0,OpenAI,SXONGQUGQWWJUTM,#ERROR!,Computer Software Stores,5734,Computer Software Stores,1,5652,Employee - Virtual,SaaS and Subscriptions,SaaS and Subscriptions,"Didi Dvash, Gal Rubin",,6307378,,,Brandlight AI LTD-PayEm-SaaS and Subscriptions-5652,10 Jan 26,01-26,($9),USD,1,($9),Technology,-,($9),Yes,OpenAI,#REF!,G&A,,,10/1/2026
2026-01-10,21:13,CLEARED,NO_SYNC,Bill + Bill payment,$5.94,USD,5.94,USD,Brandlight AI LTD,517057576,,,,,,,,,,,2026-01-10,2026-01-10,,,,,0,OpenAI,SXONGQUGQWWJUTM,#ERROR!,Computer Software Stores,5734,Computer Software Stores,1,5652,Employee - Virtual,SaaS and Subscriptions,SaaS and Subscriptions,"Didi Dvash, Gal Rubin",,6307400,,,Brandlight AI LTD-PayEm-SaaS and Subscriptions-5652,10 Jan 26,01-26,($6),USD,1,($6),Technology,-,($6),Yes,OpenAI,#REF!,G&A,,,10/1/2026
2026-01-10,21:17,CLEARED,NO_SYNC,Bill + Bill payment,$7.86,USD,7.86,USD,Brandlight AI LTD,517057576,,,,,,,,,,,2026-01-10,2026-01-10,,,,,0,OpenAI,SXONGQUGQWWJUTM,#ERROR!,Computer Software Stores,5734,Computer Software Stores,1,5652,Employee - Virtual,SaaS and Subscriptions,SaaS and Subscriptions,"Didi Dvash, Gal Rubin",,6307413,,,Brandlight AI LTD-PayEm-SaaS and Subscriptions-5652,10 Jan 26,01-26,($8),USD,1,($8),Technology,-,($8),Yes,OpenAI,#REF!,G&A,,,10/1/2026
2026-01-10,21:31,CLEARED,NO_SYNC,Bill + Bill payment,$5.45,USD,5.45,USD,Brandlight AI LTD,517057576,,,,,,,,,,,2026-01-10,2026-01-10,,,,,0,OpenAI,SXONGQUGQWWJUTM,#ERROR!,Computer Software Stores,5734,Computer Software Stores,1,5652,Employee - Virtual,SaaS and Subscriptions,SaaS and Subscriptions,"Didi Dvash, Gal Rubin",,6307471,,,Brandlight AI LTD-PayEm-SaaS and Subscriptions-5652,10 Jan 26,01-26,($5),USD,1,($5),Technology,-,($5),Yes,OpenAI,#REF!,G&A,,,10/1/2026
2026-01-10,21:34,CLEARED,NO_SYNC,Bill + Bill payment,$5.60,USD,5.6,USD,Brandlight AI LTD,517057576,,,,,,,,,,,2026-01-10,2026-01-10,,,,,0,OpenAI,SXONGQUGQWWJUTM,#ERROR!,Computer Software Stores,5734,Computer Software Stores,1,5652,Employee - Virtual,SaaS and Subscriptions,SaaS and Subscriptions,"Didi Dvash, Gal Rubin",,6307486,,,Brandlight AI LTD-PayEm-SaaS and Subscriptions-5652,10 Jan 26,01-26,($6),USD,1,($6),Technology,-,($6),Yes,OpenAI,#REF!,G&A,,,10/1/2026
2026-01-10,21:43,CLEARED,NO_SYNC,Bill + Bill payment,$11.82,USD,11.82,USD,Brandlight AI LTD,517057576,,,,,,,,,,,2026-01-10,2026-01-10,,,,,0,OpenAI,SXONGQUGQWWJUTM,#ERROR!,Computer Software Stores,5734,Computer Software Stores,1,5652,Employee - Virtual,SaaS and Subscriptions,SaaS and Subscriptions,"Didi Dvash, Gal Rubin",,6307518,,,Brandlight AI LTD-PayEm-SaaS and Subscriptions-5652,10 Jan 26,01-26,($12),USD,1,($12),Technology,-,($12),Yes,OpenAI,#REF!,G&A,,,10/1/2026
2026-01-10,21:53,CLEARED,NO_SYNC,Bill + Bill payment,$10.31,USD,10.31,USD,Brandlight AI LTD,517057576,,,,,,,,,,,2026-01-10,2026-01-10,,,,,0,OpenAI,SXONGQUGQWWJUTM,#ERROR!,Computer Software Stores,5734,Computer Software Stores,1,5652,Employee - Virtual,SaaS and Subscriptions,SaaS and Subscriptions,"Didi Dvash, Gal Rubin",,6307553,,,Brandlight AI LTD-PayEm-SaaS and Subscriptions-5652,10 Jan 26,01-26,($10),USD,1,($10),Technology,-,($10),Yes,OpenAI,#REF!,S&M,,,10/1/2026
2026-01-10,22:00,CLEARED,NO_SYNC,Bill + Bill payment,$5.81,USD,5.81,USD,Brandlight AI LTD,517057576,,,,,,,,,,,2026-01-10,2026-01-10,,,,,0,OpenAI,SXONGQUGQWWJUTM,#ERROR!,Computer Software Stores,5734,Computer Software Stores,1,5652,Employee - Virtual,SaaS and Subscriptions,SaaS and Subscriptions,"Didi Dvash, Gal Rubin",,6307577,,,Brandlight AI LTD-PayEm-SaaS and Subscriptions-5652,10 Jan 26,01-26,($6),USD,1,($6),Technology,-,($6),Yes,OpenAI,#REF!,G&A,,,10/1/2026
2026-01-10,22:26,CLEARED,NO_SYNC,Bill + Bill payment,$6.49,USD,6.49,USD,Brandlight AI LTD,517057576,,,,,,,,,,,2026-01-10,2026-01-10,,,,,0,OpenAI,SXONGQUGQWWJUTM,#ERROR!,Computer Software Stores,5734,Computer Software Stores,1,5652,Employee - Virtual,SaaS and Subscriptions,SaaS and Subscriptions,"Didi Dvash, Gal Rubin",,6307654,,,Brandlight AI LTD-PayEm-SaaS and Subscriptions-5652,10 Jan 26,01-26,($6),USD,1,($6),Technology,-,($6),Yes,OpenAI,#REF!,G&A,,,10/1/2026
2026-01-10,22:32,CLEARED,NO_SYNC,Bill + Bill payment,$5.13,USD,5.13,USD,Brandlight AI LTD,517057576,,,,,,,,,,,2026-01-10,2026-01-10,,,,,0,OpenAI,SXONGQUGQWWJUTM,#ERROR!,Computer Software Stores,5734,Computer Software Stores,1,5652,Employee - Virtual,SaaS and Subscriptions,SaaS and Subscriptions,"Didi Dvash, Gal Rubin",,6307670,,,Brandlight AI LTD-PayEm-SaaS and Subscriptions-5652,10 Jan 26,01-26,($5),USD,1,($5),Technology,-,($5),Yes,OpenAI,#REF!,G&A,,,10/1/2026
2026-01-10,22:42,CLEARED,NO_SYNC,Bill + Bill payment,$5.87,USD,5.87,USD,Brandlight AI LTD,517057576,,,,,,,,,,,2026-01-10,2026-01-10,,,,,0,OpenAI,SXONGQUGQWWJUTM,#ERROR!,Computer Software Stores,5734,Computer Software Stores,1,5652,Employee - Virtual,SaaS and Subscriptions,SaaS and Subscriptions,"Didi Dvash, Gal Rubin",,6307700,,,Brandlight AI LTD-PayEm-SaaS and Subscriptions-5652,10 Jan 26,01-26,($6),USD,1,($6),Technology,-,($6),Yes,OpenAI,#REF!,G&A,,,10/1/2026
2026-01-10,22:49,CLEARED,NO_SYNC,Bill + Bill payment,$5.20,USD,5.2,USD,Brandlight AI LTD,517057576,,,,,,,,,,,2026-01-10,2026-01-10,,,,,0,OpenAI,SXONGQUGQWWJUTM,#ERROR!,Computer Software Stores,5734,Computer Software Stores,1,5652,Employee - Virtual,SaaS and Subscriptions,SaaS and Subscriptions,"Didi Dvash, Gal Rubin",,6307725,,,Brandlight AI LTD-PayEm-SaaS and Subscriptions-5652,10 Jan 26,01-26,($5),USD,1,($5),Technology,-,($5),Yes,OpenAI,#REF!,G&A,,,10/1/2026
2026-01-10,22:52,CLEARED,NO_SYNC,Bill + Bill payment,$5.64,USD,5.64,USD,Brandlight AI LTD,517057576,,,,,,,,,,,2026-01-10,2026-01-10,,,,,0,OpenAI,SXONGQUGQWWJUTM,#ERROR!,Computer Software Stores,5734,Computer Software Stores,1,5652,Employee - Virtual,SaaS and Subscriptions,SaaS and Subscriptions,"Didi Dvash, Gal Rubin",,6307737,,,Brandlight AI LTD-PayEm-SaaS and Subscriptions-5652,10 Jan 26,01-26,($6),USD,1,($6),Technology,-,($6),Yes,OpenAI,#REF!,R&D,,,10/1/2026
2026-01-10,23:03,CLEARED,NO_SYNC,Bill + Bill payment,$6.17,USD,6.17,USD,Brandlight AI LTD,517057576,,,,,,,,,,,2026-01-10,2026-01-10,,,,,0,OpenAI,SXONGQUGQWWJUTM,#ERROR!,Computer Software Stores,5734,Computer Software Stores,1,5652,Employee - Virtual,SaaS and Subscriptions,SaaS and Subscriptions,"Didi Dvash, Gal Rubin",,6307779,,,Brandlight AI LTD-PayEm-SaaS and Subscriptions-5652,10 Jan 26,01-26,($6),USD,1,($6),Technology,-,($6),Yes,OpenAI,#REF!,G&A,,,10/1/2026
2026-01-10,23:11,CLEARED,NO_SYNC,Bill + Bill payment,$6.11,USD,6.11,USD,Brandlight AI LTD,517057576,,,,,,,,,,,2026-01-10,2026-01-10,,,,,0,OpenAI,SXONGQUGQWWJUTM,#ERROR!,Computer Software Stores,5734,Computer Software Stores,1,5652,Employee - Virtual,SaaS and Subscriptions,SaaS and Subscriptions,"Didi Dvash, Gal Rubin",,6307799,,,Brandlight AI LTD-PayEm-SaaS and Subscriptions-5652,10 Jan 26,01-26,($6),USD,1,($6),Technology,-,($6),Yes,OpenAI,#REF!,G&A,,,10/1/2026
2026-01-10,23:17,CLEARED,NO_SYNC,Bill + Bill payment,$5.63,USD,5.63,USD,Brandlight AI LTD,517057576,,,,,,,,,,,2026-01-10,2026-01-10,,,,,0,OpenAI,SXONGQUGQWWJUTM,#ERROR!,Computer Software Stores,5734,Computer Software Stores,1,5652,Employee - Virtual,SaaS and Subscriptions,SaaS and Subscriptions,"Didi Dvash, Gal Rubin",,6307814,,,Brandlight AI LTD-PayEm-SaaS and Subscriptions-5652,10 Jan 26,01-26,($6),USD,1,($6),Technology,-,($6),Yes,OpenAI,#REF!,G&A,,,10/1/2026
2026-01-11,00:54,CLEARED,NO_SYNC,Bill + Bill payment,"$1,556.01",USD,4749,ILS,Brandlight AI LTD,517057576,,,,,,,,,,,2026-01-11,2026-01-11,,,,,0,KSP,4.54E+06,"TEL AVIV, ISR, 61000",Computer Software Stores,5734,Computer Software Stores,0,5483,Employee - Virtual,Hila Haliva,Hila Haliva,,https://app.payemcard.com/api/transactions/6308145/receipt.pdf,6308145,,,Brandlight AI LTD-PayEm-Hila Haliva-5483,11 Jan 26,01-26,"($1,556)",USD,1,"($1,556)",#N/A,-,"($1,556)",#N/A,KSP,#REF!,G&A,#N/A,#N/A,11/1/2026
